TAG;PRODUCTO
27357;GALLETAS VITARELLA D TONE VITARE CHOCOLATE SORBETO
58689;KETO/CO CHOCO SEA SALT GRANOLA 6/10 OZ
21035;GALLETAS CHOCO CREAM CUETARA
21739;GALLETAS DYNAS SALADAS SALTED 340G 4PACK
21572;GALLETAS VITARELLA C/CHISPAS VAINILLA VITARELLA 120
30327;GALLETAS PASCUAL DUO PACK SALTINES CJ
44358;GALLETAS DARE GRAINSFIRST WHOLE GRAINOZ
44421;GALLETAS PASCUAL CHEESE CRISP QUESO BLANCO
21362;GALLETAS NOEL SALTIN NOEL 202G QUE/MANT/PA 9/LLE12
15700;GALLETAS MARINELA SPONCH FRESA 240GR
25917;GALLETAS ELLEDI GASTONE LAGO FROLLINI 350 GR. INTEGRAL
26039;GALLETA MARIA TUBO LA PARMIGIANA 200GR
57156;GALLETAS COLOMBINA SURTIDA TARRO 216GR
59676;GALLETAS DEVON AVENA CRUJIENTE ROLL0
59681;GALLETAS DEVON DIGESTIVA 492
59715;GALLETAS COLOMBINA MUU CREM LECHE CHOCO 396 GR
59724;GALLETAS DYNAS WAFFER PINA 100GR
25880;GALLETAS NABISCO OREO CHIPS AHOY NAVIDAD 372G
26038;GALLETA DE NAVIDAD LA PARMIGIANA 200GR
51104;GALLETAS GULLON BARQUIL DE CHOCOLATE S/A
51121;GALLETAS RIPVAN WAFELS COOKIES&CREAM 12/
17194;GALLETAS STAUFFERS MULTIPK F/ANIMAL1.5OZ
20732;GALLETAS BIMBO PRINCIPE DE LIMON MARINELA 210 G
22613;GALLETAS BAUDUCCO WAFER VANILLAGRS
16939;GALLETAS NABISCO OREO COOKIES OZ
30861;GALLETAS DANESA 340 G
27172;GALLETAS DELI CREAM FRESAPAQ.
21897;GALLETAS LAS DELICIAS S DANISH 114G DELIGHT
16951;GALLETAS MCVITIES GO AHEAD Y BERRY (UNID)
22032;GALLETAS GULLON DIGESTIVE OATS ORANGE 425G
27377;GALLETAS LIL DUTCH MAID LIL DUTCH MAID GING
28670;GALLETAS NABISCO CHIPS AHOY CANDY BLAST
57069;GALLETAS MOLI CREMAS 6 PZS VAINILLA TIRAS
25893;GALLETAS NOEL NAVIDAD NOEL TREN
16606;GALLETAS PEPPERRIDGE FARM GOLDFISH SMORES OZ.
43628;GALLETAS GULLON BARQUIL DE CHOCOLATE S/A
27356;GALLETAS VITARELLA RELL VAINILLA VITARELLA CHOCORES
21747;GALLETAS DYNAS VAINILLA 200G
22020;GALLETAS VITARELLA CRACKET TRADICIONAL 20/400GR
30891;GALLETAS OTROS CROCANTES
3077;GALLETAS COLOMBINA MERRY CHRISTMAS
22011;GALLETAS MARILAN WAFER FRESA
22687;GALLETAS VITARELLA CHOCORESCO VAINILLA 150GR
22694;GALLETAS VITARELLA TORTITAS LIMON 30/150GR
36637;GALLETAS ITAMARATY SPANTOO GALL CHOCOLATE 30/80GR ( 7891340365408 )
62503;GALLETAS CATALINA CRUNCH CHOCOVA 6/6.8OZ
26233;GALLETAS NOEL NAVIDAD LONCHERA 300G -EX
27165;NONNIS MINI BISCOTTI 37.8 OZ 28433
19890;GALLETAS MOLSA SURTIDO CHOCO RISA 24/25GR ( 809552087602 )
21998;GALLETAS SAN JORGERELLENITAS FRESA 5X8 PCK
17725;GALLETAS NOEL SALTIN DULCE TRADICION 186 GR
17726;GALLETAS NOEL SALTIN DULCE TRADICION 186 GR
27465;GALLETAS NOEL NAVIDAD COSMETIQUERA BS 80
22692;GALLETAS VITARELLA TORTITAS CHOCOLATE 30/150GR
21983;GALLETAS NOEL FESTIVAL RECREO CHIPS 432G
20052;GALLETAS PEPPERIDGE GOLFISH CHEDDAR 9PZ 255 G
22693;GALLETAS VITARELLA TORTITAS FRESA/FRUTILLA 30/150
50860;GALLETAS SPONCH FRESA PAQ UNID.GRS
22688;GALLETAS VITARELLA TRELESO FRESA/FRUTILLA
26111;GALLETAS NOEL LONCHERA NAVIDAD 300 GR
8101;GALLETAS BIMBO SANISSIMO GALLETA ARROZ INTEGRAL 108G ( 7441029519198 )
28666;GALLETAS RITZ CRACKERS WHOLE WHEAT 12.9 OZ
28932;GALLETAS NOEL SALTIN 454 GR
16934;GALLETAS NABISCO BELVITA BREAKFAST GOLDEN OAT 8 OZ
26099;GALLETAS COLOMBINA CHOCOLATE RELLENAS MOMENT 135G
11297;GALLETAS NABISCO MINI CHIPA 3.5 OZ 780262
21369;GALLETAS NOEL SALTIN DULCE TRADICION 186 GR
11505;GALLETAS BIMBO PRINCIPE CHOCOLATE 145G
19426;GALLETAS MURRAY GINGER SNAPS COOKIES 8/16OZ ( 82011100078 )
14797;GALLETAS BAUDUCCO D/MANTEQUILLA LATA 12OZ
57129;GALLETAS NABISCO CLUB SOCIAL INTEGRAL LINAZA MACA 24G
28873;GALLETAS PASCUAL SUPER SANDW LIMON UN X CJ
37919;GALLETAS RIP VAN WAFELS - MIEL Y AVENA 1.16 OZ ( 856282003099 )
21755;GALLETAS MRS BECTORS CREMICACREMICA SALTINE CRAKER 454GR
27352;GALLETAS NOEL SALTIN DULCE TRADICION 186 GR
19499;GALLETAS PAPADOPOULOS CAPRICE CLASSIC 400GR ( 5201004020338 )
38557;GALLETAS BETTER KETO CHOCOLATE CHIP COOK
38628;GALETAS PASCUAL SANDWICH FRESA FAM 142G
7550;GALLETAS GAMA CAN CAN VAINILLA 12U 45
56275;GALLETAS SIMPLE MILLS FINE ALMD FLOUR CR
27183;GALLETAS EMPERADOR COMBINADA 72G
12918;GALLETAS MARINI SAVOIARDI LADYFINGERS 200G.
25894;GALLETAS NOEL 100G NAVIDAS COFRE GIRATORIO
27596;GALLETAS VITARELLA RELLENAS CHOCORESCO VAINILL 21OZ
8559;GALLETAS WAFER FRESA COLOMBINA PAQ.
25955;GALLETAS MRS FLDS WHITE FUDGE BROWN 12/8OZ
20943;GALLETA GAMESA CREMAX FRESA GAMESA 4 PK
17439;4 PACK GAMESA 336 G CHOKIS CHOCOBASE
20945;GALLETA GAMESA CKOKIS BLACK GAMESA 63 GR
9855;GALLETAS BIMBO PROMO SALMAS 2 PACK MAS SALMITAS 325G
19529;GALLETAS MILTONS CRACKERS EVERYTHING BAKED OZ
26056;GALLETAS GAMESA CHOKIS 4PACK 360G
21748;GALLETAS DYNAS NARANJA 200G
28872;GALLETAS PASCUAL CLUB ORO X UND
7657;GALLETAS NABISCO OREO PASTEL BIRTHDAY 432G
27088;GALLETAS NABISCO ZWIEBACK TOAST 6/6 OZ ( 44000000868 )
25752;GALLETAS WALKERS DE MANTEQUILLA
25754;GALLETAS WALKERS GTA NAVIDAD 60GR ( 39047015487 )
27695;GALLETAS VITARELLA TRELESO CHOCOLATE 30/60GR
59695;GALLETAS SOPHIAS ICED OATMEAT B BACTCH
22691;GALLETAS VITARELLA CRACKET INTERAL 20/420GR
21568;GALLETAS VITARELLA RELLENA VAINILLA VITARELLA CHOCO
21563;GALLETAS VITARELLA WAFERS FRESA VITARELLA 35 GR
47044;GALLETAS COLOMBINA GALL. C/.AVENA GRANOLA 6U/180G 1*12
28875;GALLETAS LAS DELICIAS MANTEQUILLA LATA 11
28937;GALLETAS NOEL COFRE NOEL 120 GR
17438;4 PACK GAMESA 372 G CHOKIS MIX
27699;GALLETAS VITARELLA SALTVITA INTEGRAL 36/156GR
59678;GALLETAS DEVON FRUTAS ROLLO PASTEL CO
59769;GALLETAS PASCUAL CLUB ORO 9PACK 1/24
17724;GALLETAS NOEL FESTIVAL CHIPS 240G
27698;GALLETAS VITARELLA WAFER D-TONE 30/126GR
20978;GALLETAS EMPERADOR CHOCOLATE 72 GR
9054;GALLETAS GAMA SURTIDO NAVIDAD 200GR
29278;GALLETAS BETTY CROCKER COOKIE CAKE CHOC.FUDGE
4086;GALLETAS NABISCO CHIPS AHOY MINI 50 G
19627;GALLETAS LAS DELICIAS CRUNKIES CRUNKIE VAINILLA 276G
9100;GALLETAS COLOMBINA MOMENTS CHIPS CHOCO 132G
20382;GALLETAS GO AHEAD YOGURT BREAKS FOREST
21559;GALLETAS VITARELLA MARIA TRADICIONAL 400
61056;GALLETAS POZUELO SALTIN DUCALES 714GR
61131;GALLETAS CRACKERS SNACKS DE MAIZ TOSTADO CRAIZE 4.00 OZ
26087;GALLETAS NABISCO DE NAVIDAD OREO 372GR
25924;GALLETAS MOLSA WAFER SURTIDAS 12PAQ 240G
26309;GALLETAS NABISCO OREO 36G PASTEL
53322;GALLETAS GULLON DIET RONDITAS 186 GRS
20979;GALLETAS EMPERADOR NOCTURNO 91 GR
59670;GALLETAS DEVON CHOCOLATE CREMA
20464;GALLETAS PASCUAL CREAM LIMON UNIDAD 6
26102;GALLETAS COLOMBINA FELIZ NAVIDAD BOLSA 45
26404;GALLETAS NOEL FESTIVAL VAINILLA 12X6
3768;GALLETAS NABISCO OREO BLUEBERRY 432 G
56201;GALLETAS GAMESA EMPERADOR CHOC. 4PK
27254;GALLETAS KELLOGS CHEEZIT DUOZ BACON CHDR CHEESE 12.4 O
21733;GALLETAS DYNAS GALLETAS 200G
17721;GALLETAS NOEL FESTIVAL RECREO
29088;GALLETAS MARINELA SPONCH 60G
25756;GALLETAS WALKERS WLK MANT FINGERS
25885;GALLETAS PIAZZA DELEITE 30G.
56174;GALLETAS MATILDE VICENZI
19743;GALLETAS CACHAFAZ AVENA PASA 21/225G ( 7798128000677 )
56176;GALLETAS MATILDE VICENZI
27351;GALLETAS NOEL NAVIDAD COSMETIQUERA BS 80 GR
56177;GALLETAS MATILDE VICENZI
3551;GALLETAS RITZ AJO MANTEQUILLA 134.4 GR
17447;GALLETAS IVANA DE MANTEQUILLA 75G
19877;GALLETAS RELLENA CON CREMA DE VAINILLA 11
20035;GALLETAS MRS BECTORS CREMICA RIO 4 LIMON 24/12 360GRS ( 8906078260839 )
62518;GALLETAS COCO MALVINAS 140G
8622;GALLETAS NABISCO CHIPS AHOY NABISCO 152GR
62548;GALLETA DEVON CHOCOLATE CREAMS 30X140G
10865;GALLETAS MAFAM DESAYUN AM ENER 2U NUTRISNACKS 48G
47591;GALLETAS BAUDUCCO WAFER VAIN S/AZUC4.23OZ
25944;GALLETAS PRIMAL BAKERY PROTEINA 18/2.12OZ ( 860004012214 )
29208;GALLETAS SAN JORGEMULTIGRANO CRACKERS
21565;GALLETAS VITARELLA CRACKER INTEGRAL VITARRELLA 420
21561;GALLETA VITARELLA SALVITA TUBO VITALLELA 100 GR
21627;GALLETAS VITARELLA SORBETO LIMN VITARELLA 120 GR
46850;GALLETAS ORGRAN RELLENAS DE FRAMBUESA 175 GR GLUTEN FREE
27331;GALLETAS NABISCO CLUB SOCIAL MULTICERAL INTEGRAL 24 GR
26411;GALLETAS VICTORIA SABOR MIEL 30G.
19571;GALLETAS RIMITH DE MANTEQUILLA PACK FAMI 6UN ( 7451002625556 )
57437;12 PACK EMPERADOR VAINILLA 36G
25890;GALLETAS NOEL NAVIDAD 160G MUNECO NAVIDENO
19855;GALLETAS SAPORI ALMOND RICCIARELLI 12/12
36631;GALLETAS NAVIDAD DANCAKE
27041;GALLETAS KELLOGS CHEEZ IT CHEDDAR RANCH 170GR
26141;GALLETAS LOTTE CHOCO PIE 168 GR 6 PACK
26405;GALLETAS NOEL FESTIVAL CHOCOLATE 12U X6
26408;GALLETAS VICTORIA CASINO SABOR VAINILLA
28934;GALLETAS NOEL NAVIDAD DUCALES 400 GR
20763;GALLETAS POZUELO AMARRE BOKITAS+BOKITAS Q AMARILLO434GR
28737;GALLETAS MICRO STEPS DULCES ALM Y
21451;GALLETAS NABISCO MINI CHIPS AHOY 50G
28830;GALLETAS QUAKER DE AVENA 48 GR C GRANOLA
21558;GALLETAS VITARELLA CRACKET VITARELLA CREAM CRACKER 400 GR
37903;GALLETAS RIP VAN WAFELS BROWNIE DE CHOCOLATE ( 850007857974 )
28683;GALLETAS PASCUAL CRIOLLITAS
21752;GALLETAS DYNAS PREMIUM CREAMZ VAINILLA 100G
57436;12 PACK EMPERADOR CHOCOLATE 36
17560;GALLETAS NESTLE SAVOY SAMBA FRESA 32G
19745;GALLETAS CACHAFAZGRANOLA AVEN 21/225G ( 7798128000707 )
21587;GALLETAS AUSTIN CRACKER DE ANIMALES 12S 59343
20043;GALLETAS PEPPERIDGE FARM GOLDFISH CAJA 36PK 1.
7831;GALLETAS WAFER RICH MAXI FRESA 450 G
20750;GALLETAS BIMBO PRINCIPE FRESA 5 P
29209;GALLETAS OTROS BISCUIT OAT RAISINS 22 G
26046;GALLETAS PASCUAL MARIA MOLIDA PASCUAL 454GR
17722;GALLETAS POZUELO NOEL FESTIVAL MINI CHIPS 280G
19660;GALLETAS PUIG MARIA SELECTA 24/168GR ( 7591082000291 )
28869;GALLETAS PASCUAL CREMAS PASCUAL OZ
16563;GALLETAS DIGESTIVE MCVITIES DIG DARK CHOCO 24/200G
27546;GALLETAS SAN JORGE RELLENITAS VAINILLA 5X8 PCK
21743;GALLETAS OTROS BLEDOR CLUB 200GR
15169;GALLETAS PEPSICO QUAKER RICE CAKE CHOCOLATE 7.23GR
61053;GALLETAS CLUB SOCIAL INTEGRAL 32/26GR
28739;GALLETAS MARIA GOLD MILLUNID
61103;GALLETAS BARQUILLOS PIAZZA CHOCOLATE 45.3G
19969;GALLETAS GULLON BISCOTT SANDW YOGT FRUIT 8/220G ( 8410376042887 )
17888;GALLETAS LENNY & LARRYS KETO COCONUT 45G
18983;GALLETAS KEEBLER COUNT STYL OATM COOKIES 12/10 OZ ( 30100100355 )
19882;GALLETAS CON TROCITOS DE CHOCOLATE 6 5.8
27201;GALLETAS MISURA NATURA RICCA 12/ 230G ( 8002590060893 )
14714;BISQUINI GALLETA DANESA MANTEQUI 12/340G ( 768790131822 )
59693;GALLETAS SOPHIAS CHOCOLATE CHIPS B BATC
21754;GALLETAS RIO 4 MRS BECTORS CREMICA STRAWBERRY CREAM RIO 12 UND
59710;GALLETAS BRINKY FRESA 300GR
27133;GALLETAS LIL DUTCH MAID OLD FASHGINGER
26086;GALLETAS NABISCO OREO ORIGINAL BANDEJA 308 GR
28994;GALLETAS POZUELO BOKITA CRIPS DOC
26406;GALLETAS NOEL FESTIVAL LIMON 12X6
1841;GALLETAS POZUELO TOSH SURTIDAS 264GR
25963;GALLETAS MRS BECTORS CREMICA BUTTER COOKIES 114G
15736;GALLETAS COLOMBINA FELIZ NAVIDAD BOLSA 20
19620;GALLETAS GAMESA CHOKIS DULCE DE LECHE 57GR
36726;GALLETAS GAMESA 4 PACK CHOKIS RELLENA
21629;GALLETAS VITARELLA SORBETO FRESA VITARELLA 120 GR
20773;GALLETAS POZUELO BOKITAS FUSION CHOCOLATE 10 P 337GR
25916;GALLETAS ELLEDI G/LAGO MINI PARTY WAFER AVELL SF 12/125G ( 8004800003614 )
3554;GALLETAS NABISCO RITZSALAD QUESO 12U 204G
26289;GALLETAS PASCUAL 360G AVENA
26098;GALLETAS COLOMBINA CHOCOLATE CHIPS MOMENT 132GR
27597;GALLETAS GULLON CINNAMON CRISPS 235 G
29214;GALLETAS LOACKER 38G GARDENA HAZELNUT
16933;GALLETAS NABISCO CHIPS AHOY P
51339;GALLETAS DR MULLER MULTICEREAL CAKE 115G
17723;GALLETAS NOEL 320G FESTIVAL CHOCK
56296;GALLETAS NOEL FESTIVAL VAINILLA +  CHIPS
20942;GALLETA GAMESA CREMAX VAINILLA GAMESA 4PK
44355;GALLETAS NABISCO CHIPS AHOY! COOKIES 1X0.770 OZ ( 044000045326 )
20944;GALLETA GAMESA CREMAX CHOCO GAMESA 4 PK
61136;GALLETAS STAUFFERS ICED ANIM 311G
25861;GALLETAS BOKITAS QUESO PIÃ‘A PAQ.10UN ( 7441163408679 )
17515;GALLETAS GAMESA EMPERADOR CHOCOLATE + 2 GRATIS 52/91GR ( 7500478016181 )
28776;GALLETAS MUU CREMADA MAX 24/12/34GR ( 7702011271075 )
26290;GALLETAS PASCUAL NUTREX BRAN 9PACK DE AVENA MIEL
47717;GALLETAS POZUELO CASERA VAINILLA
47924;GALLETAS POZUELO CASERA COCO
56251;GALLETAS VALUE 507 MARIA 462G
53168;GALLETAS NABISCO OREO 307.8G TRAY WACAM
36649;GALLETA ST MICHEL CHOCO ST.MICHEL 121GR
61909;GALLETAS GAMESA DELICIAS CLASICA 130 GR
16925;GALLETAS NABISCO TEDDY GRAHAM CINNAMON BIG BAG 3OZ
25962;GALLETAS MRS BECTORS CREMICA BUTTER COOKIES 340G
19994;GALLETAS MSUPFOODS BLUEBRY VAIN HERO GALL 6/6.25Z ( 851893004053 )
48130;GALLETAS NABISCO CAJA SURT MINIOREO 6U
20164;GALLETAS BERRY FARM FRAMBUESA KNOTTS 72OZ
22690;GALLETAS VITARELLA WAFER VAINILLA 30/120GR
27320;GALLETAS PIRUCREAM COCO LATA GRANDE 300G
21720;GALLETAS SIMSEK BISCUVI CHOCO PAYE 216 GR
21721;GALLETAS SIMSEK BISCUVI CHOCO PAYE 216 GR
44356;GALLETAS NABISCO GOLDEN OREO 22 GR ( 044000045432 )
27544;GALLETAS SAN JORGECRAKNEL INTEGRAL
22014;GALLETAS MARILAN TOSTADA INTEGRAL TORRADA INTEGRAL
56226;GALLETAS VICTORIA INTEGRAL CKERS SALVADO D
21556;GALLETAS VITARELLA RELLENA CHOCOLATE VITARELLA TREL
25733;GALLETAS KEEBLER GALLETA E.L FUDGE ORIG 12/13.6OZ ( 30100112990 )
56227;GALLETAS VICTORIA INTEGRAL CKERS QUINUA VI
21560;GALLETAS VITARELLA SORBETO CHOCORESCO VITARELLA 120 G
19880;GALLETAS SALADAS SIN GLUTEN
25953;GALLETAS MRS FIELDS C.AVENA Y PASAS
20982;GALLETAS EMPERADOR CHOCOLATE 91GR
33646;GALLETAS OREO CHOCOLATE SANDWICH COOKIES 30/2.4Z ( 44000047009 )
44380;GALLETAS PASCUAL CRISP DOC PROM PASCUAL
44405;GALLETAS PASCUAL CRISP DOC PROM PASCUAL
61049;GALLETAS ESTRELLITA FRESA 10 UNID
38772;GALLETAS POZUELO CHIKY BLAK 8 UND 304 GRS.
29253;GALLETAS MARILAN BRIGADEIRO 40/115GR
38631;GALLETAS GULLON MINI CHOCO CRISP 18/8/
20540;GALLETAS SNACK TIME CRACKERS 284GR
27233;GALLETAS MRS FIELDS NATURAL VAN ANIMAL CRACKERS
36641;GALLETAS ITAMARATY SPANTOO GALL CHOCO BLANCO 45/30GR ( 835281003453 )
53111;GALLETAS POZUELO BOKITAS FUSION CHOCOLATE 10 P 337GR
36714;GALLETAS PASCUAL 360G DE MANTEQUIILA
21735;GALLETAS DYNAS MINI CRACKERS RANCH 227G
19744;GALLETAS CACHAFAZ AVENA CHIP 21/225G ( 7798128000691 )
28658;GALLETAS MINI OREO NABISCO 30 1.5 OZ
25943;GALLETAS PRIMAL BAKERY HGH PROTEI BREAD 20/15.2Z ( 860004012207 )
51379;GALLETAS PASCUAL MANTEQUILLA FAMILIAR 1/
19526;GALLETAS LAS DELICIAS LAS DELICIAS GTA WAFER FRESA 24/168G ( 603554023152 )
21982;GALLETAS NOEL 54G FESTIVAL RECREO
56157;GALLETAS GAMESA EMPERADOR VAINILLA 4PK
22024;GALLETAS MARINI DE ALMENDRA 250GR
21744;GALLETAS MRS BECTORS CREMICA RIO 4 VAINILLA CREAM 360GR
22042;GALLETAS SUPER CARNES MARCELA COCO/PASITA
58547;GALLETAS SIMPLE MILLS ALMND FLR SEA SALT CRACKER 6/4.9Z ( 856069005353 )
22760;GALLETAS CLASSIC MIX 779GR
28706;GALLETAS POZUELO BOKITA CRIPS DOC
16926;GALLETAS NABISCO PREMIUM SALT
52736;GALLETAS CUETARA DULCE ARTESANAS ORIGIN
7674;GALLETAS NABISCO CHIPS AHOYUNID DE 57 GR
18991;GALLETAS KEEBLER FUDGE COV COCO DREAMS 12/8.5OZ ( 30100944034 )
25749;GALLETAS WALKERS GTA NAVIDAD SANTA MINI 200G ( 39047015265 )
27037;GALLETAS LORNA DONE SHORTBREADOZ
29262;GALLETAS GULLON COOKIE TWINS SANSWICH
27292;GALLETASS LAS DELICIAS MANTEQUILLA LATA 3
25911;GALLETAS ITAMARATY SPANTOO GALL CHOCO BLANCO 30/80GR ( 7891340365422 )
51102;GALLETAS GULLON WAFER VAINILL DIET NATUR
51140;GALLETAS NOEL SODA TACO GR
25713;GALLETAS LOTUS BISCOFF 4 OZ
59649;GALLETAS NABISCO CLUB SOCIAL ARROZ SILVESTRE 24/24GR ( 7622201798710 )
38534;GALLETAS VALUE 507 GALLETA MARIA 462G
28927;GALLETAS NESTLE COCOSETTE MAXI WAFER 12(6X50GR)
17437;4 PACK GAMESA 228 G CHOKIS
27547;GALLETAS SAN JORGE RELLENITAS FRESA 5X8 PCK
56214;GALLETAS NABISCO CHIPS AHOY EXHB GR UND
26101;GALLETAS GALLETA ARBOLITO NAVIDAD COLOMBINA 200GR
59672;GALLETAS DEVON VAINILLA CREMA
25758;GALLETAS 544 CHOC CHUCK HNUT BISC 150 GR 12 CJ
20764;GALLETAS POZUELO AMARRE BOKITAS+BOKITAS Q BLANCO 434GR
36640;GALLETAS MATILDE VICENZI GRISBI COCONUT 12/150GR ( 8000350005238 )
44372;GALLETAS RIP VAINILLA WAFELS WAFEL GALLETITAS Y CREMA DE PROTEÍNAS ( 851532008411 )
36668;GALLETAS COLOMBINA MOMENTS FANCY COOKIES COLOMBINA
38558;GALLETAS BETTER KETO DOUBLE CHOCOLATE CH
29213;GALLETAS LOACKER 38G GARDENA CHOCOLATE
11510;GALLETAS BIMBO PRINCIPE GALLETA FRESA 85 GR
17087;GALLETAS PASCUAL SORBETO CHOCOLATE 372GR ( 52577036333 )
61082;GALLETAS FAT SNACK GALLETAS MANTEQ MANI G/F 20/1.4
18981;GALLETAS KEEBLERKEEBLER SANDIES CLASSIC 12/11.2 OZ ( 30100100195 )
56222;GALLETAS VICTORIA CASINO VAINILLA VICTOR
56133;GALLETAS BOWL & BASKETS RBB GOLDEN SANDWICH COOKIES 12
56297;GALLETAS NOEL FESTIVAL CHOCO+CHIPS
61097;GALLETAS AVENA ICED DEL TIO US
26063;GALLETAS DANESAS GOLDEN SELECTION 117G
61064;GALLETAS CINNABON CLASSIC COOKIES 3OZ
26689;GALLETAS NABISCO OREO MINIS SURTIDO 279GR
21742;GALLETAS RAVIFOODS DUKES SANDWICH VAINILLA GEO CAJA 368
25932;GALLETAS GULLON BISZCOCHOS G
21331;GALLETAS COLOMBINA CRAKEÑAS CLUB 204 GR.
15735;GALLETAS BOLSA FELIZ NAVIDAD 150GR
21210;GALLETAS NABISCO MINI OREO BOLSA 250G
21564;GALLETAS VITARELLA WAFERS CHOCORESCO VITARELLA 35 GR
16943;GALLETAS NABISCO CHIPS AHOY THINS ORIGINAL 7OZ
59671;GALLETAS DEVON COCO CREAMA 140
59729;GALLETAS ADORO CRACKERS CON ITALH
62573;GALLETA COCOSETTE GALLETA 12/50GR
18989;GALLETAS KEEBLERKEEBLER CHIPS DLX COCONUT 12/14.1 OZ ( 30100122852 )
53328;GALLETAS GULLON DIET SANDW C/CREMA 210 G
56134;GALLETAS BOWL & BASKETS RBB SESAME WTR CRACKERS 12/4.4
27096;GALLETAS PASCUALSAND. LIMON CAJA 36X26GRS ( 52577022749 )
56224;GALLETAS VICTORIA CASINO FRESA VICTORIA
51138;GALLETAS  NESTLE CHOCOLATE COCOSETTE 50G
51338;GALLETAS DR MULLER QUINUA RICE CAKE 115G
20588;GALLETAS TRESOR DORE GALLETA C/CHOC SURT TRESORDORE C 230 GR
38635;GALLETAS COLOMBINA 200 G NAVIDEN
7912;GALLETAS BAUDUCCO WAFER BITES HAZELNUT
61547;GALLETAS POZUELO CLUB EXTRA CANELA Y AZUCAR MORENA 225 GR
62549;GALLETA DEVON COCONUT CREAMS 30X140G
55348;GALLETAS TOSH 2PK MIEL Y AVENA
51117;GALLETAS SIMPLE MILLS GALLETASS CRUNCH DBL CHOC
51118;GALLETAS SIMPLE MILLS FARMHSE CHEDDAR CRCKER 6
57372;GALLETAS TOSH 2PK MIEL Y AVENA
62737;Pesebre Navidad Galletas 12pl 1 200g
3045;GALLETAS POZUELO TRADICIONALES VAINILLA 300GR
44023;GALLETAS POZUELO MANTEQUILLA MANI BOKIT
44431;GALLETAS MARINI CANTUCCINI DE CHOCOLATE GALLETA
19602;GALLETAS GAMESA CHOKIS 4PACK 57GR
61127;GALLETAS CRACKERS MAIZ DULCE CRAIZE 4.00 OZ
7551;GALLETAS GAMA CAN CAN CHOCOLATE 12U
55712;GALLETAS POZUELO TOSH PACK SIN AZUCAR 264G
16577;GALLETAS COLOMBINA BOLSA FELIZ NAVIDAD 450G
59620;GALLETAS GAMESA CHOKIS BLACK 63G
61112;GALLETASAVENDY  AVENA AVENDY 240G
59665;GALLETAS SIMPLE MILLS ALMOND FLOUR SNICKERDOODLE 6/6.2OZ ( 856069005421 )
59697;GALLETAS BRIDGE INDIVIDUAL AVELLANA
36630;GALLETAS DANCAKE DULCES DANESITA 454 GR
36632;GALLETAS DANESITA SHORTBREAD COOKIES 10/250G ( 5601069112175 )
44027;GALLETAS TOSH 2PK MIEL Y AVENA
44028;GALLETAS TOSH 2PK MIEL Y AVENA
14844;GALLETAS COLOMBINA MINICASITA NAVIDAD 50G
14783;GALLETAS BAUDUCCO WAFER COCONUT 165GR
56256;GALLETAS NOEL FESTIVAL GALLETAS RELLENAS
56220;GALLETAS VICTORIA GLACITAS TOFFEE VICTOR
56278;GALLETAS SIMPLE MILLS GARLIC HERB CRACKE
61080;GALLETAS FAT SNACK DOBLE CHOCO G/F 20/1.4
61129;GALLETAS CRACKERS SNACKS DE COCO CRAIZE 4.00 OZ
21566;GALLETAS VITARELLA TRELOSO CHCO VITARELLA 60 GR
25919;GALLETAS ELLEDI G/LAGO GALLETA CREMA LECHE 12/350G ( 8004800006530 )
16562;GALLETAS MCVITIES MIL/CHOCOLATE DIGESTI
3413;GALLETAS RELLENAS DE CREMA
62736;Galleta Surtida Colombina 200gr
58541;GALLETAS LAGO MINI PARTY COCO 12/125GR ( 8004800003454 )
25747;GALLETAS WALKERS GLUTEN FREE SHORTBREAD 140G
62501;GALLETAS HIGHKEY MINI BROWNIE 6/2OZ
58688;GALLETAS SIMPLE MILLS ALMND FLR CHOCO CHIP 6/6.2 OZ ( 856069005384 )
37225;GALLETAS NABISCO ORIGINAL 8U OREO 288G
56135;GALLETAS BOWL & BASKETS RBB GARLIC WTR CRACKERS 12/4.4
15030;GALLETAS NABISCO CHIPS AHOY MINI 50 G
58610;GALLETAS NOEL 300G NAVIDAD COFRE
19791;GALLETAS MATILDE VICENZI SOFT AMARETTO 12/125G ( 8000350005504 )
25812;GALLETAS ASIAN GOURMET RICE PLAIN3.5 ONZ
10742;GALLETAS CUETARA CASERA ARTESANA ORIGINAL 330 G
19044;GALLETAS WALKERS OATFLAKE&CRANBERY 150G ( 39047050105 )
59702;GALLETAS GAMESA CHOCO CHOKIS CHOC 84GR
25755;GALLETAS WALKERS GTA NAVIDAD MINI ARBOL 150GR ( 39047015760 )
59741;COLOMBINA PIAZZA VAINILLA 45 3 GR
61480;GALLETAS BIMBO MARINELA BARRITAS MINI FRESA 270 GR
62407;GALLETAS POZUELO BOKITAS DULCE DE LECHE
15936;GALLETAS BEST GALLETA CHOCOLATE 264GR
19603;GALLETAS GAMESA CREMAX 4PACK CHOCOLATE
21160;GALLETAS NABISCO CHIPS AHOY BOLSA 240 G
21571;GALLETAS VITARELLA TORTITAS LIMON 150 GR
59696;GALLETAS SOPHIAS ALMONETTE B BATCH 340G
59703;GALLETAS BEST MANI  22 GR
59784;GALLETAS QUAKER BUTTER POPCORN RIC CAKE 86G.
56180;GALLETAS ELLEDI LAGO PARTY STRAW VAINILLA
56298;GALLETAS NOEL FESTIVAL FRESA +CHIPS
43683;GALLETAS WALKERS CHOCOLATE 150 GR.
51158;GALLETAS NABISCO HONEY 14.4OZ
56007;GALLETAS ARTESANAS TRADICIONAL
6562;GALLETAS SANDW OREO MINI 25 GR N2008530 02027
19626;GALLETAS LAS DELICIAS CRUNKIES CRUNKIES FRESA 24/276G
58560;GALLETAS NABISCO ORIGINAL 8U OREO 288G
17436;GALLETAS GAMESA CREMAX 4PACK FRESA
59723;GALLETAS DYNAS WAFFER NARANJA 100 GR
10133;GALLETAS POZUELO MARIA ROLLO PAQUETE 8UND 168 GRS
25866;GALLETAS PASCUAL MARIA GALLETA MOLIDA 453GR ( 7451086600777 )
47723;GALLETAS TOSH AVENA GRANOLA 156
20541;GALLETAS OTROS ZIPS ORIGINAL CRACKER 288GR
21365;GALLETAS NOEL FESTIVAL MINI CHIPS 280 G
56189;GALLETAS MCVITIES SESAME 125 GR
21170;GALLETAS NABISCO MILKA CHOCOLATE WAFFER MILKA BOLSA 360G
25899;GALLEAS TERRA KARAVANSAY GALL ARROZ INTEGRAL 14/60GR ( 7707357440666 )
27607;GALLETAS QUEST PROTEIN COOKIE PEANUT BUTTER 58 G.
58576;GALLETAS EL CORTE INGLES SURTIDO DE GALLETAS 400G
21562;GALLETAS VITARELLA WAFERS CHOCOLATE VITARELLA 35 GR
61096;GALLETAS AVENA DEL TO AL UNCLE
20946;GALLETA GAMESA CHOKIS MIX GAMESA 4 PK 93 GR
56158;GALLETAS GAMESA EMPERADOR CHOCOLATE  4PK
61130;GALLETAS CRACKERS SNACKS DE GUAYABA CRAIZE 4.00 OZ
61180;GALLETAS MARIA TUBULKAR 2PACK
56218;GALLETAS NOEL FRESA 4+2 CHIPS FES
44368;GALLETAS NESTLE OCOSETTE 200G ( 7591016171806 )
33486;GALLETAS UNCLE ALS D CHOCO.CHIP 5 OZ
17886;GALLETAS LENNY & LARRYS KETO CHOCO CHIP 45G
7279;GALLETAS BIMBO GTA PRINCIPE FRESA 210G
26055;GALLETAS GAMESA CHOKIS GAMESA 4 PK 57 GR
20748;GALLETAS BIMBO MARINELA PRINCIPE CHOCO FRESA MARINELA TU
36712;GALLETAS PASCUAL CHOCO CREAM VAINILLA FAM 1/24/190 G
61155;GALLETAS PASCUAL SANDWICH CHOCOLATE FAM
1802;GALLETAS POZUELO MARIA ROLLO PAQUETE 8UND 168 GRS
25757;GALLETAS WALKERS GTA NAVIDAD MINI ESTRELLA 125G ( 39047018167 )
25918;GALLETAS ELLEDI G/LAGO GALLETA HUEVO 12/350G ( 8004800006523 )
57429;GALLETAS  PASCUAL 306G CLUB ORO INTEGRAL
26395;GALLETAS POZUELO AMARRE BOKITAS+BOKITAS Q BLANCO 434GR
16576;GALLETAS COLOMBINA ARBOLITO NAVIDAD 200G
22612;GALLETAS BAUDUCCO WAFER STRAWBERRYGR
16927;GALLETAS NABISCO RITZ BITS CHEEESE OZ.
15852;GALLETAS ORGRAN DE MANZANA Y CANELA 175G
16928;GALLETAS NABISCO MINI CHIPS A
16940;GALLETAS NABISCO CHIPS AHOY COOKIE CHEWY 19 5OZ
62502;GALLETAS HIGHKEY MINI MANTE MANI 6/2OZ
62515;GALLETAS VAINILLA MALVINAS 140G
3495;GALLETAS MARINELA PRINCIPE VAINILLA 210GR
36708;GALLETAS PASCUAL CREAM FRESA EXHIBIDOR 24/1488G
36716;GALLETAS PASCUAL GALLETA DE PASITA DOCENA
61095;GALLETAS CHIP CHOCO DEL TIO AL
7913;GALLETAS BAUDUCCO WAFER BITES VAINILLA
57439;GALLETAS POZUELO TIPO LECHE 24 310 GRS
58720;GALLETAS PASCUAL DE COCO 360 GR
7356;GALLETAS GAMESA CHOKIS CHOCOMAX 90 GRAMOS
26410;GALLETAS VICTORIA CASINO COCO 43G.
18528;GALLETAS GLUTINO LEMON CITRON 71.1 OZ.
25570;GALLETAS NABISCO OREO MEGA STUF 17.6OZ
25813;GALLETAS ASIAN GOURMET RICE SESAME3.5 ONZ
26088;GALLETAS GALLETAS ORIGINAL OREO BOLSA 264G
25721;GALLETAS KEEBLER CHIPS DELUXE CHOCOLATE 12/11.6OZ ( 27800100884 )
18979;GALLETAS SANDW KEEBLER 354 G CHOC DELUXE G
58578;GALLETAS PASCUAL CRISP FINAS HIERBAS 156 GR
57489;GALLETAS FORMIS PAW PATROL FRESA 86GR
36724;GALLETAS MARCELA CASITA DE GALLETA NAVIDENA
62833;Colombina Galleta Surtida Arbol Feliz Navidad 200g
56221;GALLETAS VICTORIA GLACITAS CHOCOLATE VIC
44024;GALLETAS TOSH AVENA GRANOLA 156
58550;GALLETAS BHU KETO BITES CHOCOLATE CHIP COOKIE
59679;GALLETAS DEVON COCO ROLLO PASTEL CORT
21140;GALLETAS NABISCO OREO PASTEL 36 GR
51557;GALLETAS COLOMBINA GALLETA NAVIDENA DUPLEX 400G
59711;GALLETAS BRINKY CHOCOLATE COLOMBINA 600GR
38560;GALLETAS BETTER KETO DELIG COLLAGEN COOK
59726;GALLETAS ADORO SALTINE 340GR
16578;GALLETAS GALLETA NAVIDENA DUPLEX COLOMBINA 400GR
46878;GALLETAS BIMBO GALLETA SANISSIMO CHIA Y LINAZ
59700;GALLETAS POZUELO BOKITAS RELLENA BS.X10 Y 2
57484;GALLETAS ARCOR TRIUNFO CHOCOLATE 90GR
26409;GALLETAS VICTORIA CASINO SABOR FRESA 43G
25750;GALLETAS WALKERS GTA NAVIDAD MUÑECO NIEVE 200GR ( 39047015272 )
25779;GALLETAS NABISCO OREO MINI VP 30CT ( 44000061487 )
26005;GALLETAS PASCUAL MARIA LECHE CONDEN DOC PASCUAL 3
59648;GALLETAS NABISCO OREO 28/6X36G
59674;GALLETAS DEVON BOURBON CREMA
61015;GALLETAS WHOLESOME PANTRY GENGIBRE 12/10 OZ
61042;GALLETAS ABSOLUTELY GALLETAS ORIGINAL GF 12/5.29OZ
61043;GALLETAS ABSOLUTELY GTA FLATBREADS EVERYT 12/5.29
25722;GALLETAS KEEBLER GALLETA DELUXE RAINBOW 12/11.3OZ ( 27800100907 )
25920;GALLETAS SAVOIARDI G/LAGO HOJALDRES GLASEADOS 20/1
26047;GALLETAS PASCUAL SURTIDAS DE NAVIDAD PASCUAL 408
55068;GALLETAS COLOMBINA BOLSA FELIZ NAVIDAD 200G
59643;GALLETAS POZUELO PACK SODA POZUELO
59731;GALLETAS ADORO SALTINE 454 GR
59742;COLOMBINA PIAZZA FRESA 45 GR
36674;GALLETAS CI GALLETA AVENA Y PASAS 1 C U
20727;GALLETAS MARINELA PRINCIPE VAINILLA 210GR
26283;GALLETAS PASCUAL SAND ARROZ LECHE 24/12UN 360G ( 52577036890 )
46965;GALLETAS RITZ QUESO
25915;GALLETAS ELLEDI G/LAGO MINI PARTY WAFER COCOA SF 12/125G ( 8004800003607 )
60458;GALLETAS NABISCO OREO 28/6X36G
61022;GALLETAS BOWL&BASKET BISCOCHO ALMENDRA 12/7 OZ
52316;GALLETAS DULCES CUETAR COCAN 75 G 13076
51389;CHEESE CRISP DOC QUESO BLANC DE
25718;GALLETAS KEEBLER CHIPS DELUXE ORIGINAL 12/12.6OZ ( 27800100808 )
25886;GALLETAS COLOMBINA MOMENTS FANCY COOKIES 325G
36709;GALLETAS PASCUAL SANDWICH VAINILLA DOCENA
20947;GALLETA GAMESA CHOKIS CHOCOBASE GAMESA 4 PK
13847;GALLETAS CREMA COMBINACION
61014;GALLETAS WHOLESOME PANTRY CHOCOLATE CREMA 12/12OZ
61019;GALLETAS BOWL&BASKET SP AGUA ORIGNL 12/4.4 OZ
59661;GALLETAS CATALINA CRUNCH KETO SANDWICH CHOCO MINT 6/6.8Z ( 850017468337 )
59743;COLOMBINA PIAZZA CHOCOLATE 44 GR
61024;GALLETAS BOWL&BASKET BISCOCHO ARANDANO 12/7 OZ
51120;GALLETAS RIPVAN WAFELS DUTCH CRML &VAINI
59760;GALLETAS EL CORTE INGLES CHOCO CHIP 225G
61046;GALLETAS ABSOLUTELY GTA MACARRONE CHOCO G/F 6/10Z
51157;GALLETAS COCONUT DREAMS
36706;GALLETAS PASCUAL MARIA FAMILIAR 200GR
57485;GALLETAS ARCOR TRIUNFO FRESA 90GR
21737;GALLETAS DYNAS MINI CRACKERS CEBOLLA 227G
