TAG;PRODUCTO
19205;GALLETAS PASCUAL CHOCO CREAM CHOCO 24X6PACK
20455;GALLETAS PASCUAL COCO DOCENA
19573;GALLETAS DISPLAY MINI CHOKIS 12/39G
30453;GALLETAS GULLON MARIA USAGR
19350;GALLETAS SOPHIAS MINI CANDY CHOCO CHIP 12/8 OZ ( 73124507526 )
29112;GALLETAS ROYAL DANSK R DANSK COOKIES BUTT
21837;GALLETAS PASCUAL SANDWICH VAINILLA
20970;GALLETAS GAMESA CHOKIS MIX 93 GR
33577;GALLETAS DIBELLA BISCOTTI BLUEBERRY LIMON 6.6OZ ( 852358003239 )
46932;GALLETAS QUAKER GRANOLA 192 GR MULTIPACK 4 UND
18377;GALLETAS NABISCO CHIPS AHOY MINI SNAK SAKSOZ
29175;GALLETAS DE MANTEQUILLA
22388;GALLETAS BAKERS BATCH D RAYS OATMEAL COOKIESGRS.
20436;GALLETAS PASCUAL SAND FRESA DOCENA GR
34250;GALLETAS DIBELLA BISCOTTI APRICOT ALMOND 6-1.1OZ
18071;GALLETAS LIL DUTCH MAID L.DUTCH MAID CH
55739;GALLETAS COLOMBINA CRAKENA UVA/MACAD 6UND-165985
30770;GALLETAS NESTLE FITNESS AJONJOLI 27 GR
27182;GALLETAS DESTROOPER BUTTER WAFER COOKOZ
19398;GALLETAS LOACKER MRS FIELDS CHOCOLATE C
27463;GALLETAS NESTLE FITNESS INTEGRAL UND
29146;GALLETAS GULLON AVENA FIBRAGR
28977;GALLETAS GULLON-AVENA FIBRA OAST-RAISINS 250G
30479;GALLETAS GULLON SURTIDOGR
32443;GALLETAS TASTY CHOICE S DE AVENA GR
20457;GALLETAS PASCUAL PASAS DOCENA GR
32039;GALLETAS DIBELLA BISCOTTI APRICOT ALMOND 6.6OZ ( 852358003253 )
30799;GALLETAS TATES BAKE SHOP COCONUT CRISP COOKIES
19690;GALLETAS PACK WAFER NUCITA INDIV GR.
32035;GALLETAS DIBELLA BISCOTTI DOUBLE CHOC FUDGE 6.6OZ ( 852358003062 )
32521;GALLETAS KEEBLER SIMPLY MADE BUTTER COOKIES 12 10
19711;GALLETAS NOEL DUX INTEGRALPAQUETES
21848;GALLETAS PASCUALCLUB ORO PASCUAL 9PACK (306G)
34470;GALLETAS MONDELEZ CLUB SOCIAL INT ARROZ 24GR
30643;GALLETAS NABISCO CHIPS AHOY BLACK WHITE 114 GR
30887;GALLETAS DISPLAY MINI MAMUT 13G CHOCOLATE
49381;GALLETAS BIMBO MARINELA CANELITA 60 GR.
21676;GALLETAS LIL DUTCH MAID LIL DUTCH MAID ICED - OZ
26358;GALLETAS ROYAL DANSK COOKIES BUTTER MINI 15 200 GR
32398;GALLETAS BIMBO SALMITAS SANISSIMO PK 45 GR
28905;GALLETAS GAMESA EMPERADOR VAINILLA 303GR
18022;GALLETAS JOCASTA VINNESE W HAZELNUT GRS.
35495;GALLETAS LIL DUTCH MAID L.D.M.VANILLA WAFERS COOKIESONZAS
34383;GALLETAS PASCUAL SANDWICH FRESA S AZUCAR
28778;GALLETAS NESTLE FITNESS YOGURT FRESA
21860;GALLETAS PASCUAL NUTREX BRAN AVENA MIEL 306G 9UNI
32638;GALLETAS VIRGINIA CACAO SIN AZUCAR 120 GR
28711;GALLETAS BRAZILIAN BISCUIT ITAS DE MANI
30481;GALLETAS GULLON MARIA BIO ORGANICGR
22592;GALLETAS CHORISAS VAINILLA CHOCOLATE 300G
20856;GALLETAS SAND.DULCE DE LECHE UND
35609;GALLETAS ORGANIC GOLDEN ROUND CRACKERS 10 OZ
19516;GALLETAS DANESA WONDERFUL COP 150 GR.
30522;GALLETAS COCONUT CHIPS DELUXE OZ CJ
27378;GALLETAS POZUELO JUMBO FIBRA
51214;GALLETAS OREO DE CHOCOLATE 36 GR.
33793;GALLETAS ROLAND DE ALBARICOQUE 200 GR TARTALETA
35410;GALLETAS PEPPERIDGE FARM GOLDFISH 45CT/1OZ ( 14100046691 )
35608;GALLETAS FIG BARS DADDY RAYS OZ
18398;GALLETAS NABISCO OREO THINS 10.1OZ
19698;GALLETAS NOEL FESTIV.VAINILLA NOEL
29166;GALLETAS BAUDUCCO WAFER DISPLAY FRESA
21038;GALLETAS CUETARA KRIT SALADA REDONDA 288 GRS
32677;GALLETAS PASCUAL SORBETO FRESA
35659;GALLETAS DIBELLA BISCOTTI BLUEBERRY LEMON 6-1.1OZ
29305;GALLETAS CLUB & CHEDDAR 1.3 OZ.
35529;GALLETAS PROMO DUO
17695;GALLETAS WAFER NUCITA MINITACOGRAMOS
30383;GALLETAS DANESITA CREAMY KISS CHOCOLATEGR
32704;GALLETAS ROYAL DANSK FATHER CHRISTMAS KEL.
20462;GALLETAS PASCUAL CHEESE CRISP QUESO BLANCO GR
34539;GALLETAS BUFF BAKE COOKIE CHOCOLATE DONUT
20987;GALLETAS GAMESA CREMAX NIEVE FRES
32034;GALLETAS DIBELLA BISCOTT PISTACHO CRANBERRY 6.6OZ ( 852358003024 )
32634;GALLETAS VIRGINIA PREMIUN CACAO INTEN 120
46865;GALLETAS SORB NARANJ 10U COLOMBINA 300G
34541;GALLETAS BUFF BAKE COOKIE SNICKERDOODLE ALMOND BUTTER
34039;GALLETAS DAELMANS STROPWAFELS HONY JMBO 8/10.2Z ( 853754003359 )
21348;GALLETAS NOEL FESTIVAL VAINILLA UND
20557;GALLETAS FIG BAR 284 GR
33797;GALLETAS ROLAND TUBOS RELLENOS 12 3.5 OZ PIR
46849;GALLETAS SHEILA GS BROWNIE C CHISPAS DE CHOCOLATE MENTOLADO 5 OZ.
18992;GALLETAS HY TOP DE LIMON 32OZ
32649;GALLETAS BUFF BAKE COOKIE CLASSIC CHOCOLATE CHIP
25746;GALLETAS WALKERS BUTT SHTB HIGHLANDERSGR
28957;GALLETAS BAUDUCCO SORBETO OBLEA CON RELLEN.CHOCO
34529;GALLETAS EMOTICON SUGAR COOKIE KIT
22510;GALLETAS DULCE VAINIL ESCOLAR 12U GAMA264G
30769;GALLETAS COLOMBINA CRAKENAS QUINUA HOJUELA COLOMBINA 12
30451;GALLETAS ITAMARATY ATREVIDOS CHOCOLATEGR
35480;GALLETAS NABISCO FIG NEWTON BARS 12/10OZ ( 44000046545 )
19343;GALLETAS SOPHIAS VANILLA CREM
19826;GALLETAS MISURA BISC PRIVOLAT CACAO 10.23Z
33853;GALLETAS SOPHIA'S SOFT FROSTED LEMON 12 7 1 OZ
31857;GALLETAS NABISCO HONEY MAID CINNAMON 14.4 OZ
25769;GALLETAS DEBEUKELAER PIROULINE CREME TIN 14 ONZ
18063;GALLETAS LIL DUTCH MAID DUTC MAID OATME
32639;GALLETAS VIRGINIA AVENA SIN AZUCAR 110 G
17187;GALLETAS ORGRAN GALL D VAINILLA F D CARAS 150 GR
35593;GALLETAS OREO DOUBLE STUFF 15.25 OZ
33889;GALLETAS BELGIAN BUTTERS FINE ALMOND THI N 12 50G
35502;GALLETAS CLA MANTE MANI DAWN OZ
21349;GALLETAS NOEL FESTIVAL LIMON UND
35604;GALLETAS JULES D DE MANTEQUILLA 100 GR
35515;GALLETAS APPLE BARSONZ.D RAYS
30418;GALLETAS BARRIFRUT SABOR FRESA 6 S 222 GRS 496847
32211;GALLETAS BARBARA'S BAKERY SABOR VAINILLA
20560;GALLETAS STRAWBERRY BARS 284 GR
30800;GALLETAS H STINGER WAFFLE STRAWBERRY UND
33826;GALLETAS DARE COOKIE LEMON CREME 12/10.2 OZ ( 55653111252 )
33910;GALLETAS WELLINGTON TRAD WATER CRACKERSOZ
32040;GALLETAS DIBELLA ALMOND ORANGE 12 1 1OZ
21850;GALLETAS PASCUAL CRISP CHEESE 37GR
32288;GALLETAS TASTY CHOICE T CHOICE DE COCO GRS.
53042;GALLETAS WAFER BRIDGE VAINILLA 10U-165637
35681;GALLETAS QUAKER CHOCOLATE CHIP UND
35548;GALLETAS ITAMARATY LOOK SNDWCH CHOCO HAZEL 30/115G ( 7891340365118 )
30971;GALLETAS POZUELO CLUB EXTRA
19786;GALLETAS MATILDE VICENZOVO LADY FINGER 9/300G ( 8000350000462 )
33811;GALLETAS FIG NEWTONS SINGLE SERVERONZ
17710;GALLETAS NOEL DUCALES CELLO PAQ.G
33938;GALLETAS BUDS BEST D CHOCO.CREM
19835;GALLETAS COLUSSI DULCES 600 GR
34126;GALLETAS NABISCO CHIPS AHOY MINI CHOC 28G
32322;GALLETAS GULLON TORTITAS DE ARROZ 12/130 GR ( 8410376033151 )
35761;GALLETAS MRS FIELDS 1 COOKIEŸFUDGEŸBROWNIE 2 1 OZ
22635;GALLETAS DE AVENA 40 GR.
20990;GALLETAS QUAKER DE AVENA 38 GR FRUTOS ROJOS
21576;GALLETAS ROYAL DANSK ROYAL COOKIES BUTTERC TIN 681GR
34651;GALLETAS SODA 8 PACK
33812;GALLETAS NABISCO CHIPS AHOY 100CAL 6/6PK 0.81 OZ ( 44000053437 )
32585;GALLETAS RITZ DOCENA MX 12 21 6 GR
34260;GALLETAS PAMELAS COOKIES CHOC CHIP WF GF OZ
34239;GALLETAS BAUDUCCO SAB BANANA Y C 125 GRS
30431;GALLETAS NESTLE COCOSETTE MAXI WAFER 12/400G PAGE7X8
35841;GALLETAS MINI MAMUT CHOCOLATE
30653;GALLETAS NESTLE FITNESS BISCUIT SESAME 24(9X27G)PE
34087;GALLETAS CLUB CRACKERS ORIGINAL X OZ
28868;GALLETAS PASCUAL SORBETO X UND CASA GOLY
32389;GALLETAS PASCUAL SBT FRESA DOCENA
22584;GALLETAS MOLSA WAFER RICHE FRESA
35823;GALLETAS LIL DUTCH MAID ASSORTED CREME 13OZ.
46857;GALLETAS GAMESA CHOKISCHOCOMAX 4 PAQUETINES
35624;GALLETAS DE AVENA GR PARMIGIANA
34124;GALLETAS NABISCO CHIPS AHOY REAL CHOCOLATE 6 OZ
34132;GALLETAS OREO 14.3 OZ
19836;GALLETAS COLUSSI DULCES 600 GR
35514;GALLETAS STRAWBERRY BARSONZ.
32520;GALLETAS KEEBLER CLUB CRACKER ORIGINALONZ.
57042;GALLETAS GAMESA EMPERADOR 5PK CHOC 14/303GR ( 7501000666874 )
19762;GALLETAS ITAMARATY WAFER MORANGO G
32394;GALLETAS PASCUAL SORBETO VAINILLA SIN
25097;GALLETAS DULCES WAFFER MOLSA 240 G VAIN 5615
35663;GALLETAS MAFAM AVENA PASAS 48G
47100;GALLETAS GULLON SANDWICH DIET NATURE OZ
19764;GALLETAS ITAMARATY WAFER NAPOLITANOGR
20535;GALLETAS MCVITIES BOLS SUSPR CHOCOL 15GR
32043;GALLETAS DIBELLA ALMOND ORANGE 12 1 1OZ
30801;GALLETAS OATMEGA CHOCO CHIP OM-3S 12/80GR ( 816926020219 )
21450;GALLETAS ROYAL DANSK COOKIES BUTTER &CH CHIP GR
25100;GALLETAS CHORISAS VAINILLA CHOCOLATE 300G
21677;GALLETAS LIL DUTCH MAID L.D.M GINGER SNAPS X OZ
47069;GALLETAS NABISCO OREO CHOOCOLATE 432 GR
27464;GALLETAS POZUELO NOEL TRIGO Y MAIZ UND
35656;GALLETAS CASABITOS DE YUCA SABOR NAT 185G
32630;GALLETAS RONDOLETTI COOKIE CREAM
21866;GALLETAS PASCUAL SANDWICH CHICLE PAQ.12UN
21350;GALLETAS NOEL FESTIVAL FRESA UND
20961;GALLETAS PIRUCREAM 300 GRS
35785;GALLETAS BAUDUCCO WAFER FRESA GRAMOS
32384;GALLETAS NABISCO FIG NEWTONS ONZA
27459;GALLETAS LOACKER CRISPY WAFER CREMKAKAO 90GR
26225;GALLETAS TIO YEYO CANASTA 210 GR
19817;GALLETAS MISURA BISCOTTI NOCCIOLE 7.05 OZ
26212;GALLETAS PASCUAL NAVIDENA 220 G
35477;GALLETAS NABISCO OREO BIRDAY CAKE OREO OZ
34586;GALLETAS KRIT QUESO 422 GR 732127
33986;GALLETAS DR SCHAR CHOCO DIPPED COOKIES
19942;GALLETAS GULLON WAFER CHOCO AVELLANAGR
35821;GALLETAS LIL DUTCH MAID CHOCO CREME COOKIES 14ONZ(397)
20438;GALLETAS PASCUAL SODA DOCENA GR
34251;GALLETAS DIBELLA BISCOTTI CARAMELLO MACCHIATO 6-1
20984;GALLETAS GAMESA MINI CHOKIS 38
47092;GALLETAS GULLON FIBRA INTEGRAL 170 GRMS.
22585;GALLETAS MOLSA WAFER RICH CHOCOLATE
30806;GALLETAS VIRGINIAS MINI VITA BOER NATA S AZUCAR UNID.
33940;GALLETAS J.DESTROOPER ALMOND THINS OZ
28237;GALLETAS OREO DORAD CREM/LIM THIN10.1OZ
21675;GALLETAS LIL DUTCH MAID OATM - OZ
35745;GALLETAS BAUDUCCO ORIGIN 66GR
34252;GALLETAS DIBELLA BISCOTTI ALMOND COCONUT MOCHA 6-
19769;GALLETAS ITAMARATY SPANTOOO FRESAGR
29138;GALLETAS BAUDUCCO WAFER WAFER CHOCOLATE
32635;GALLETAS VIRGINIA PREMIUN NARANJA 120 GR
34178;GALLETAS LUNDBERG RICE CAKE BRWN SF ORG GF
28824;GALLETAS CAJA DE DE MANTEQUILLA
19972;GALLETAS DIET BARQUILLOS CACAOGRS
34212;GALLETAS SODA CUETARA 8PAQT 200GR
51203;GALLETAS GAMESA CHOKIS 63 GR
33846;GALLETAS SOPHIA'S LEMON SANDWICH X PIEZAS
12670;GALLETAS CRAKINUA GRNOSANCESTRALES12BS/6/30GRS 18
32636;GALLETAS VIRGINIAS ACTIVA 180 GR TUBO B-SAN
19574;GALLETAS LONCHERA MINI CHOKIS GR
34247;GALLETAS DIBELLA BISCOTTI PISTACHIO CRANBERRY 6.6
35601;GALLETAS PASCUAL SANDWICH VAINILLA SI
34261;GALLETAS PAMELAS COOKIES SHRTBRD PECAN WF GF
53320;GALLETAS GULLON PASTAS SIN GLUTENGR
26155;GALLETAS VAINILLA WAF
29504;GALLETAS GAMESA EMPERAD VAINILLA 6PK 240G
29066;GALLETAS KINNIKINNICK KINNIKRITTERS GRAHAM
33978;GALLETAS MISURA CRACKERS SOJA OLIO 12/400GR
32675;GALLETAS PASCUAL SORBETO PASCUAL FRES
28600;GALLETAS KEEBLER SALTINE ORIGINAL
21711;GALLETAS POZUELO BOKITAS C QUES 35 GR
20026;GALLETAS MAFAM MACADAMIA 48GR
53404;GALLETAS DULCE CHOC ESCOLAR 12U GAMA264G
19938;GALLETAS GULLON MINI CRACKERGRS
21853;GALLETAS PASCUAL MINI CHOCO CHIPS PACKG
19950;GALLETAS GULLON DIGESTIVE BISCUITSOZ
57141;GALLETAS NESTLE FITNESS INTEGRAL 249234
57033;GALLETAS RITZ TUBO 67.5 GRS
33906;GALLETAS SHEILA GS SHEILA BROW BRITTLE SALT CARAMEL8/2.75Z ( 711747011135 )
17716;GALLETAS NOEL SALTIN TRIGO Y MAIZ POZUELO G
32633;GALLETAS VIRGINIA PREMIUN CARAMELIZAD 100
20449;GALLETAS PASCUAL AVENA FAMILIAR GR
34253;GALLETAS DIBELLA BISCOTTI VANILLA LATTE 6-1.1OZ
20442;GALLETAS PASCUAL MARIA DOCENA GR
29067;GALLETAS KINNIKINNICK KINNTOOS CHOCOLATE SANDWICH
25798;GALLETAS SOPHIA'S OATMEAL COO
10848;GALLETAS COLOMBINA CRAKENAS CON PROBIOTICOS 12BS/8/27GRS 21
32678;GALLETAS PASCUAL SORBETO VAINILLA PCK
34527;GALLETAS U SUN FOODSTUFF DISNEY PRINCESS CASTLE 10.72 OZ
21950;GALLETAS CANELA UN GR PARMIGIANA
55048;GALLETAS LOTUS BISCOFF 120 GR.
28931;GALLETAS NESTLE FITNESS YOGURT FRESA
19953;GALLETAS GULLON DIET BARQUILLOS VANIGR
32637;GALLETAS VIRGINIA CHOCOLATE BIOSAN 120 GR
47099;GALLETAS GULLON BARQUILLOS CHOCO OZ
35603;GALLETAS JULES D DE ALMENDRA 100 GR
34548;GALLETAS MRS FLDS BUTTER COOKIES PCN PR 12/2.5Z
55409;GALLETAS NABISCO OREO FRESA 12U 432G
30411;GALLETAS TASTY CHOICE T CHOICE MANTEQUILLA GR
35597;GALLETAS NABISCO CHIPS AHOY CHUNKY 11.75 OZ
20452;GALLETAS PASCUAL CHOCO CREAM VAINILLA GR
25807;GALLETAS LOACKER COCONUT 3.53 ONZ
35780;GALLETAS NOEL FESTIVAL 806G ALCANCIA
19827;GALLETAS MISURA BISCUITS PVL MIELE 12/400G
34037;GALLETAS DIBELLA BISCOTT COCONUT ALMD MOCHA 6.6OZ ( 852358003727 )
25096;GALLETAS MOLSA WAFER RICH CHOCOLATE
35792;GALLETAS INDEFINIDA CHOCOLACHIP
35469;GALLETAS PIROU CRISP 3PK 2363
30804;GALLETAS RONDOLETTI CHOCOLATE
21793;GALLETAS KEEBLER CLUB & CHEDDOIR 10.4 OZ
26222;GALLETAS LIOR MANTEQUILLA 45 GR
33578;GALLETAS DIBELLA BISCOTTI CHERRY CHOC. 6.6OZ ( 852358003260 )
28970;GALLETAS MOLSA SALITAS SODA 8 UND 160 GRS
29659;GALLETAS EMPERADOR COMBINADO CHOCOLATE
52771;GALLETAS QUAKER DE AVENA 48 GR C GRANOLA
35554;GALLETAS SCHAR LADYFINGERS
19939;GALLETAS GULLON MINI CRACKERGRS
34196;GALLETAS TASTY CHOICE VAINILLA GR
35570;GALLETAS CRUNCHMASTER MLT-SEED ROAS GRL 12/4.5 OZ ( 879890000038 )
20962;GALLETAS PIRUCREAM 155 GRS
34036;GALLETAS DIBELLA BISCOTTI CARAMELO MACHIATO 6.6OZ ( 852358003703 )
22275;GALLETAS NILLA MINI WAFER12/311 GR
30700;GALLETAS CERELINE PETIT BEURRE CHOC LAIT 12/150G ( 3556940025377 )
20845;GALLETAS GAMESA CHOKIS CHISPAS CHOC 228 GR
28724;GALLETAS DANCAKE DANESITA CHOCO CHIP COOKIESGR.
51198;GALLETAS QUAKER DE AVENA 48 GR C PASAS
21678;GALLETAS LIL DUTCH MAID VAINILLA CREME 12-13 OZ
46966;GALLETAS NABISCO CHIPS AHOY REGULAR TUBO 30X143
26000;GALLETAS PASCUAL COMBINACION X UND GR
20454;GALLETAS PASCUAL COCO X UND
27073;GALLETAS WALKERS SHORTBREAD PURE BUTER MANTEQUILLA 5.3 ONZ
20459;GALLETAS PASCUAL SALTINES FAMILIAR GR
53087;GALLETAS POZUELO SALADA QUESO BOKITAS POZUELO 362G
19828;GALLETAS MISURA BISCUITS SZ YOGURT 12/400G
21692;GALLETAS POZUELO BOKITAS POZUELO TUBO 231 110GRS.
30503;GALLETAS CRUNCHMASTER SN CRACKER PRTN ROAST GRL 12/3.5Z ( 879890001318 )
30851;GALLETAS PAPADOPOULOS MINI BISCO CHOCOLATE CHIPS & COCOA
6635;GALLETAS POZUELO SODA SALADA PAQ 8 UND
32036;GALLETAS DIBELLA DOUBLE CHOCOLATE FUDGE 12 1 1OZ
19825;GALLETAS MISURA PRIVOLAT CHOCALATE 10.23Z
33905;GALLETAS SHEILA GS SHEILA BROW BRITTLE CHOC CHIP 8/2.75Z ( 711747011128 )
19943;GALLETAS GULLON WAFERS MIX NATA&CHOCOGR
29095;GALLETAS PARMIGIANA SAND DULCE LECHE 12 GR
34190;GALLETAS POZUELO QUESO Y JAMON 10+2 434.4 GR
32626;GALLETAS OATMEGA DE AVEBA MACADAMIA
30550;GALLETAS PASCUAL CHOCO CREAM MANI 6 PACK
30654;GALLETAS NESTLE MILO SANDWICH COOKIE 24(12X6.4GR
33753;GALLETAS BELGIAN 80 GR
30416;GALLETAS MARIAS VAINILLA ROLLO
34211;GALLETAS DE SODA
28765;GALLETAS GAMESA EMPERADOR 5PK VAINILLA 14/303GR ( 7501000666881 )
22478;SANISSIMO TOSTADAS DE MAIZ HORNEADAS 140
35595;GALLETAS ROITZ ORIGINAL 10.30 OZ
20430;GALLETAS PASCUAL LECHE FAMILIAR GR
34487;GALLETAS COSTA DONUTS CHOCOLATE 6 PAQ 336 GR
32253;GALLETAS FILET BLEU SABLE AU BEURRE FRAIS 12/130G ( 3556940811642 )
34131;GALLETAS OREO HEAD OR TAILS DOUBLE STUFF 15.25OZ
51007;GALLETAS COLOMBINA MUUU MANTEQUILLA COLOMBINA 24 34
21710;GALLETAS POZUELO BOKITAS CRIPS
28959;GALLETAS BAUDUCCO WAFER NUECES BAUDUCCO 36 140 GRS
18090;GALLETAS MERBA COOKIES DARK CHOC & HAZELNUT 200GR ( 8710502007866 )
21843;GALLETAS PASCUAL SODA CRACKERS CLASSI
21719;GALLETAS POZUELO BOKITAS QUESO BLANCO EXTRA CONTENIDO
35475;GALLETAS COPPENRATH D MANZANA CANELA 3.5 OZ
20469;GALLETAS PASCUAL SORBETO CHOCOL.LONCHERA 12PK
34533;GALLETAS DIBELLA BISCOTTI VAINILLA LATE 6.6OZ ( 852358003734 )
33856;GALLETAS LOACKER WAFER LEMON 12/45G ( 76580000235 )
22029;GALLETAS MOLSA KIDDY VAIVAI VAINILLA 300G
32628;GALLETAS RONDOLETTI CHOCOLATE
32316;GALLETAS MISURA BISCUITS SZ COCOA 12/380G
26942;GALLETAS NABISCO OREO CHOCOLATE 36GR UND
19706;GALLETAS NOEL SALTIN NOEL PAQUETE 9 UNID
34609;GALLETAS KEEBLER CLUB ORIGINAL 16 OZ
35476;GALLETAS OREO SANCWICH CHEESE MULTIPACK 12 OZ
29150;GALLETAS DISNEY FROZEN HOLIDAY CASTLE 10.72 OZ
35736;GALLETAS MONDELEZ CLUB SOCIAL INT TRIGO 24GR
26156;GALLETAS KEEBLER CHIPS CHOCOLATE 12 11.6 ONZAS
21371;GALLETAS NOEL DUX INTEGRAL
22643;GALLETAS DE MANTEQUILLA 15U 510
51193;GALLETAS GAMESA EMPERADOR G CHOCOLT 40G
30685;GALLETAS LIL DUTCH MAID CHOCOLATE CREMA COOK - OZ
20440;GALLETAS PASCUAL SODA GR
35759;GALLETAS MAFAM SUGAR FREE P BUTTER GRS.
30513;GALLETAS PEPPERIDGE MILANO FRAMBUESA
34379;GALLETAS NABISCO R CRACKERS HANDI SNACKS
32212;GALLETAS BARBARA'S BAKERY C CHISPAS D CHOCOLATE
32037;GALLETAS DIBELLA PISTACHIO CRANBERRY 12 1 1OZ
53044;GALLETAS WAFER BRIDGE CHOCOLATE 10U-165644
30688;GALLETAS PEPPERIDGE MILANO FRAMBUESA
32533;GALLETAS CERELINE PETIT BEURRE CHOC NOIR 12/150G ( 3556940762951 )
20476;GALLETAS PASCUAL NUTREX BRAN AVENA MIEL 9 PACK 306 GR
35436;GALLETAS DULCES SIMPLES JOSEPHS
32230;GALLETAS SOPHIA'S CHOCOLATE S
35437;GALLETAS DULCES SIMPLES JOSEPHS
29913;GALLETAS STAUFFERS D/JENGIBRE NAVID 12OZ
35541;GALLETAS NESTLE FITNESS GALLETA COCO
35440;GALLETAS DULCES SIMPLES JOSEPHS
35533;GALLETAS BUD'S BEST GALL CHOCOL MINT CREM 12/6 OZ
34177;GALLETAS LUNDBERG RICE CAKE BRWN LS ORG GF 8 5 OZ
34143;GALLETAS PASCUAL SANDWICH FRESA SIN AZUCAR PACK
20471;GALLETAS PASCUAL SORBETO CHOCOL.F PACK 117GRS.
33798;GALLETAS DEBEUKELAER PIROULUXE COOKIES BE
28668;GALLETAS NABISCO CHIPS AHOY ORIGINAL 13 OZ
35744;GALLETAS CHOCO DONUTS CHOCOLATE BLANCO
47500;GALLETAS SALUD NABISCO KRAKER B 252GR
35537;GALLETAS MANT.CHOCOLATE JULES
32430;GALLETAS POZUELO BOKITAS JAMON QUESO 362 GR
34198;GALLETAS TASTY CHOICE ALMENDRA GR
34007;GALLETAS HANNAH MAXI COOKIE CHOCO CHIP 12/5 OZ ( 817472020012 )
35750;GALLETAS BACK TO NATURE CLSS ROUND CKRS 6 8.5 OZ
27346;GALLETAS NESTLE LA LECHERA SANDWICH 24(12X38GR)
33881;GALLETAS CERELINE BARRE CHOC COEUR D LAIT 18/120G ( 3556940796406 )
35589;GALLETAS SAL PREMIUM ORIG 453 G N2000569
26400;GALLETAS DE ANIMALITO 15U
34188;GALLETAS MINI BARRITA 8 PACK PINA FRESA 624 GR
32648;GALLETAS DIBELLA BLUEBERRY LEMON 12 1 1OZ
21952;GALLETAS LIMON UN GR PARMIGIANA
28971;GALLETAS CHOCORISAS CHOCOLATE VAINILLA 300 GR 12U
20470;GALLETAS PASCUAL SORBETO VAINILLA LONCHERA 12PK
32235;GALLETAS SOPHIA'S P SHORTS CO
20559;GALLETAS BLUEBERRY BARS 284 GR
35543;GALLETAS QUAKER MINIS MANZANA CANELA 64/40G ( 7702189041197 )
46880;GALLETAS POZUELO FUSION DE CEREAL 256.5G TOSH
20524;GALLETAS ALMONETTE OZ
46887;GALLETAS POZUELO CLUB EXTRA INTEGRL 225GR
30485;GALLETAS GULLON MINI CHOCO CHIPS GR
30523;GALLETAS KEEBLER TROZ CHOCOLATE 328GR
35539;GALLETAS PIRULIN BARQUILLITAS RELLENA 24/300 ( 7591675010508 )
34181;GALLETAS LUNDBERG RICE CAKE LTSLT BRWN FRMD WILD
20472;GALLETAS PASCUAL SORBETO FRESA F PACK 117 GRAMOS
19846;GALLETAS MISURA BISCOTTI MULTI 120G ( 8002590045647 )
17729;GALLETAS NOEL SALTIN NOEL QUESO MANT
46863;GALLETAS SORB FRES 10U COLOMBINA 300G
35591;GALLETAS MINI OREO BOLSA 3 OZ
22634;GALLETAS DE PASITAS 40GR.
43868;GALLETAS POZUELO TOSH LIMON TE VERDE
28972;GALLETAS CHOCORISAS CHOCLATE FRESA 300GR
30753;GALLETAS TIO YEYO MINIS 1 UND
20558;GALLETAS APPLE BARS 284 GR
47074;GALLETAS MANTEQUILLA LA COSTA 250529
31899;GALLETAS MURRAY SHORTBREAD S FREE 6ONZ
21359;GALLETAS NOEL DUCALES PAQUETITOS
32407;GALLETAS CLEARLY ORGANIC UNSALTED RICE CAKES 4.9 OZ
33579;GALLETAS DIBELLA BLUEBERRY LEMON 12 1 1OZ
34259;GALLETAS MARYS GONE CRACKER GF HERB ORG
33971;GALLETAS ITAMARATY HOBBY CHOCOLATE FLAVOR
34175;GALLETAS STAUFFERS 12OZ MILK CHOCOLATE STARS- BOX
29123;GALLETAS LOACKER CRISPY WAFER VAINILLE 90GR
33849;GALLETAS SOPHIA'S COCONUT M CREMES SAND.12 15 OZ
28956;GALLETAS BAUDUCCO SORBETO OBLEA CON RELLENO FRES
27343;GALLETAS NESTLE FITNESS BISCUIT RED FRUITS XGR
19848;GALLETAS MISURA BISCOTTO ZENZERO NATURA RICA 250G ( 8002590048280 )
34134;GALLETAS NUTTER RELLENAS DE MANI 48 53G
20855;GALLETAS SANDWICH VAINILLA PAQ PARMIGIANA
53165;GALLETAS OREO CHOCOLATE 432 GR.
33521;GALLETAS BUDS BEST STRAWB CREMES 6OZ
53321;GALLETAS GULLON BARQUILLOS DE VAINILLA 219 GRMS.
21947;GALLETAS SANDWICH VAINILLA PAQ PARMIGIANA
34517;GALLETAS CASABITOS DE YUCA PREM/NATURAL
34425;GALLETAS PANAMA GOURMET DE PINA Y JENGIBR 85
21644;GALLETAS GULLON CHOCOLATE Y SOJA 216 GRS 6 PACK SIN AZUCAR
51609;GALLETAS BAUDUCCO SORBETO OBLEA CON RELLEN.CHOCO
32234;GALLETAS SOPHIA'S SHORTBREADOZ
35559;GALLETAS HANNAH MAXI COOKIE DRK CHOC CHIP 12/5 OZ ( 817472020128 )
27529;GALLETAS PASCUAL CREMAS SALTINES 50GR
30401;GALLETAS POZUELO SALADAS BOKITAS OTROS
34180;GALLETAS LUNDBERG RICE CAKE SLTFR BRWN FRMD GF
26157;GALLETAS KEEBLER SOFT BATCH CHOCO CHIP
32676;GALLETAS PASCUAL SORBETO PASCUAL VAIN
35596;GALLETAS NAVISCO CHIPS AHOY ORIGINAL 13 OZ
28719;GALLETAS CERELINE PETIT BEURRE BISCUITS 24/200G ( 3556940009117 )
21901;GALLETAS S DANISH NUTRIMEALS 80G TIPO DANESAS
33866;GALLETAS PANOS BRANDS SESMARK SALADAS DE ARROZ 3.20 OZ FINAS
47058;GALLETAS OREO COOKIES CREAM
32865;GALLETAS NABISCO RITZ BITS CHEEESE OZ.
34133;GALLETAS RITZ BITS 3 OZ 321500
28777;GALLETAS NESTLE FITNESS YOGURT NAT.117.5G
55049;GALLETAS LOTUS BISCOFF 250 GR.
21841;GALLETAS PASCUAL SANDWICH FRESAOZ
53258;GALLETAS CRAKENAS AVE/MIEL 8UND-165987
33867;GALLETAS SESMARK RICE THINS SNCK SESAME 12/4.25OZ ( 85693107007 )
27582;GALLETAS LOACKER WAFER CHOCOLATE 12/45G ( 76580160182 )
35555;GALLETAS SCHAR CHEESE BITES GF
55710;GALLETAS MARINELA PRINCIPE CHOCO PAQ 336G ( 7441029516142 )
34479;GALLETAS BRIDGE SUGAR FREE CHOCOL 24TC 1153 GR
35462;GALLETAS ROLAND RASPBERRY TAR
35571;GALLETAS MRS FIELDS D LECHE&CHO
35042;GALLETAS GAMESA CHOKIS CHISPAS CHOC 252GR
33840;GALLETAS STAUFFERS GINGER SNAPS 60/2.13Z ( 72320124520 )
27679;GALLETAS DE LIMON 15U X510GR.
35647;GALLETAS COSTA DE SODA GR
35711;GALLETAS MC VITIES YOGHURT BR SULTANA Y STRAW 35.
10850;GALLETAS CRAK-PROBIOTI.FRUTOSROJOS 12BS/8/27GR 21
53326;GALLETAS GULLON DESAYUNO DIET NATURE 8 216G
47095;GALLETAS MARIA GULLON 400 GRMS.
55067;GALLETAS COLOMBINA 260 G MOMENTS DANESAS
47089;GALLETAS MOLI RELLENA VAINILLA 312 GR
34381;GALLETAS PASCUALSORBETO C VA
35599;GALLETAS RITZ CRACKERS WITH CHEESE 304GR
34249;GALLETAS DIBELLA BISCOTTI ALMOND ORANGE 6-1.1OZ
35553;GALLETAS SCHAR TABLE CRACKERS
33973;GALLETAS ITAMARATY HOBBY SANDW BC MORANGO 30/100G
28973;GALLETAS MOLSA KIDDY VAIVAI VAINILLA 300G
26396;GALLETAS POZUELO BOKITAS QUESO JAMON+2
19841;GALLETAS COLUSSI SALADAS COLUSSI 500 GR
28940;GALLETAS OREO COOKES CREAM 12-36 GR
53141;GALLETAS DULCE FRESA ESCOLAR 12U GAMA264G
30452;GALLETAS ITAMARATY HOBBY SANDW BC CHOCO 30/100G
28960;GALLETAS BAUDUCCO WAFER SABOR AVELLANA 140 GRS
47476;GALLETAS DULCA GAMA CHOCO MAD 552GR
34415;GALLETAS TASTY CHOICE T CHOICE DE VAINILLA GR
20616;GALLETAS COLOMBINA PIAZZA BARQUILLOS VAINILLA 45 GR.
30524;GALLETAS KEEBLER EXPORT SODA LATA 28 ONZAS
21851;GALLETAS PASCUAL DE COCO PASC
22679;GALLETAS NOEL SALTIN NOELPAQUETES
32164;GALLETAS BELGIAN 110 GR
46884;GALLETAS POZUELO NOCHE BUENA PLEGADIZA
46882;GALLETAS POZUELO TOSH AVENA GRANOLA PAQ.
26220;GALLETAS STAUFFERS MANTEC NAV CHOC/BL12OZ
17242;GALLETAS POZUELO BOKITAS PIZZA
19842;GALLETAS COLUSSI SALADAS COLUSSI 500 GR
34010;GALLETAS HANNAH MAXS COOKIE CHIPS CHOCO GF 12/5Z ( 817472020098 )
47097;GALLETAS GULLON DIGESTIVA DE AVENA
34206;GALLETAS GAMESA CHOKIS CHISPAS CHOC 199GR
30612;GALLETAS EMPERADOR VAINILLA 100 GR.
30468;GALLETAS OATMEGA COOKIE 80G ( 816926020202 )
26221;GALLETAS LIGO DANESA MANTQ 6/908G ( 72810775102 )
32518;GALLETAS BELGIAN BUTT ALM-100G
32476;GALLETAS NOEL WAFER NOEL TC. 82 GR
53121;GALLETAS COSECHA D.SOYA VAINILLA 230 GR
17309;GALLETAS PARMIGIANA DE CANELA 6 GR
16643;GALLETAS NATURE VALLEY BISCUITS COCOA A
27531;GALLETAS PASCUAL SORBETO VAINILLA LONCHERA 12PK
51192;GALLETAS EMPERADOR COMBINADO CHOCOLATE
27589;GALLETAS COSTA SODA 180GR
19843;GALLETAS COLUSSI SALADAS COLUSSI 500 GR
30484;GALLETAS GULLON GULLON TORTITAS DE MAIZ 12/130 GR ( 8410376033144 )
27528;GALLETAS PASCUAL CHOCO CREAM CHOCOLATE PAQ 24UN
33972;GALLETAS ITAMARATY HOBBY WHITE CHOCOLATE
46888;GALLETAS POZUELO INT ALBAH TOMAT CHIA TOSH 256.5G
18078;GALLETAS POZUELO SODA
33736;GALLETAS SUZIES SESAME KAMUT FLAT BREADOZ
33792;GALLETAS ROLAND TEDDY GRAH HONEY3.25OZ
30505;GALLETAS CRUNCHMASTER CRACKERS OLIVE OIL SSAL 12/3.54 Z ( 879890001356 )
28725;GALLETAS BROWNIE DANESITA 150 G
29121;GALLETAS LOACKER BITE SIZE WAFER COOKIES LEMON 125GR
35567;GALLETAS DIBELLA BISCOTT RASPBE WHITE CHOC 6.6OZ ( 852358003710 )
33737;GALLETAS SUZIE'S FLATBREAD SPLT MULTSEED 12/4.5OZ ( 22929515304 )
34210;GALLETAS SAL CUETAR KRIT TUB 100 G
47499;GALLETAS NABISCO BELVITA HONY BRAN 297 GR
33909;GALLETAS SHEILA GS BROWNIE C CARAMELO CRUJIENTE 5 OZ.
33939;GALLETAS BUDS BEST DE CARAMELO
21328;GALLETAS BRIDGE MTACO FRESA 77GR
34412;GALLETAS DE MARACUYA GR PARMIGIANA
34590;GALLETAS CRAKEÑAS SALTIN INTEGRAL 8 UND.
19304;GALLETAS STAUFFERS GINGER SNAPS 12/14 OZ ( 72320124421 )
51018;GALLETAS DULCES NAVIDAD COLOMBINA
20434;GALLETAS PASCUAL COMBINACION DOCENA
34248;GALLETAS DIBELLA BISCOTTI DOUBLE CHOCOLATE FUDGE
30331;GALLETAS PACUAL CHOCO CREAM MANI 6UNID 372G
28794;GALLETAS MATILDE VICENZI CIAMBELLINI AL BURRO 85G ( 8000350004590 )
46893;GALLETAS POZUELO TOSH CHOCOLATES Y AVELLANA PAQ.6
19211;GALLETAS PASCUAL BUSITO SANDWICH DOCENAS
28870;GALLETAS PASCUAL SAND-VAINILLA GR
51009;GALLETAS CRAKEÑAS MULTICEREAL MIEL 192 GR.
19760;GALLETAS LENNY AND LARRYS COOKIES MACADAMIA 16OZ
34429;GALLETAS PIRUCREAM TWO PACK NAVIDENO
53037;GALLETAS SHEILA GS BROWNIE C CHISPAS DE CHOCOLATE 5 OZ.
57111;GALLETAS POZUELO DE MANTEQUILLA POZUELOS 10 PACK
35547;GALLETAS ITAMARATY HOBBY STRAWBERRY FLA GR
34199;GALLETAS TASTY CHOICE MANTEQUILLA GR
35590;GALLETAS NABISCO MINI CHIPS A
35479;GALLETAS NABISCO DULCES CHIPS AHOY 44 GR
32702;GALLETAS NESTLE MOROCHAS 18(8X30G)
35594;GALLETAS NABISCO WHEAT THINS CRACKERS HINT 9.1 OZ
34593;GALLETAS VOORTMAN WAFFER SABOR VAINILLA 100G
35639;GALLETAS NESTLE MILO SANDWICH 476 GR 12PA
22490;GALLETAS EMPERADORDE CHOCOLATE 6 PACK 240 GR.
16968;GALLETAS AMARETTI WAFERS GRAMOS
21856;GALLETAS PASCUAL SORBETO CHOCOL.LONCHERA 12PK
27678;GALLETAS DE NARANJA GR PARMIGIANA
32042;GALLETAS DIBELLA CHERRY CHOCOLATE 12 1 1OZ
19829;GALLETAS COLUSSI DULCES 400 GR
35598;GALLETAS NABISCO TEDDY GRAHAMS CHOCOLATE 10 OZ
53262;GALLETAS CRAKINUA GRANOS ANCEST-165982
29122;GALLETAS LOACKER CRISPY WAFER NAPOLITANER 90GR
53147;GALLETAS CUETARA 12 U SABORES CREMA
34213;GALLETAS SORBET CUETARA YOGURT-FRESA PAQ 250 GR
35710;GALLETAS ENTERTAIMENT CRACKER
49430;GALLETAS QUAKER DE AVENA 38 GR FRUTOS ROJOS
32263;GALLETAS DANESITA APPLE STRUDELGR.
34426;GALLETAS PANAMA GOURMET DE DOBLE CHOCOLAT 85
35819;GALLETAS LIL DUTCH MAID VAINILLA CREMA 13OZ.
51162;GALLETAS NABISCO CRACKERS CHIPS ORIGINAL 8 OZ
49463;GALLETAS SALADA RITZ 12U 259.2G
35786;GALLETAS VOORTMAN WAFFER SABOR CHOCOLATE 100G
28930;GALLETAS NESTLE FITNESS YOGURT NATURAL
34428;GALLETAS PIRUCREAM 24 GR
