TAG;PRODUCTO
19250;GALLETAS PASCUAL 306G NUTREX FRUTO ROJO 9PACK
19500;GALLETAS PAPADOPOULOS CAPRICE CLASSIC WAFER ROLLGRS.
29171;GALLETAS DYNAS MINI CRACKERS SALTED 227G
19501;GALLETAS PAPADOPOULOS CAPRICE CLASSIC WAFER ROLLGRS.
29165;GALLETAS MAX&ALEX WAFELS CARAMELO 200GR
20865;GALLETAS LA PARMIGIANA ANIMALITOS 204 GR
20565;GALLETAS VOORTMAN DE COCO Y LIMON VOORTMAN 200GR
25909;GALLETAS ITAMARATY ATREVIDOS WHITE CHOCGR.
25800;GALLETAS SOPHIAS CHOCOLATE CREME 10.05 OZ
29163;GALLETAS MAX&ALEX BISCUITS CARA 107GR
19861;GALLETAS ELLEDI POKER MAXI VANILLA CREAM 32 DE 1
20742;GALLETAS BIMBO PRINCIPE CHOCOLATE 145 GR
29170;GALLETAS DYNAS MINI CRACKERS PIZZA 227G
27291;GALLETAS PASCUAL SANDWICH DUO PACK 360GR
1744;GALLETAS POZUELO NAVIDAD CF.MUNECO NAVIDENO 160GR
29164;GALLETAS MAX&ALEX WAFFLES 175GR
3546;GALLETAS SAL RITZ NABISC ORIG PAQ 268.8G 12U
29198;GALLETAS PAPADOPOULOS BARQUILLOS GOLOS/PAPADOPOULOS 53G CAPRICE CLASSIC
27583;GALLETAS LOACKER GARDENA CHOCOLATE 38G
3344;GALLETAS PEPPEDRIGE FARM DULCES C-AVEN Y PASAS 7883
20566;GALLETAS COLUSSI REDICCUORI GOCCE 12/300G
18107;GALLETAS LOTTE CHOCO PIE 168 GR 6 PACK
30458;GALLETAS COLUSSI BISCOTTI GRANTURCHESE 12/800GR ( 8002590045043 )
30549;GALLETAS JOCASTA WAFERS STRAWBERRY GR
20872;GALLETAS MINI MARIA 204 GR
3445;GALLETAS QUAKER AVENA MANZA/CANELA PAQ 4 ( 803275305579 )
19707;GALLETAS NOEL 403G FESTIVAL SABOR A COCO
13014;GALLETAS MARINELA PLATIVOLOS ECONO PACK 296GR
19694;GALLETAS COLOMBINA CRAKEÑAS DORADITAS 168 GR.
19427;GALLETAS MURRAY CHISP/CHOC S/AZUC 8.8OZ
17566;GALLETAS PUIG KATY VAINILLA FAMILIAR 256 GR
34676;GALLETAS NOEL 181297 SODA BOLSA 24/9/0.19 GR
30459;GALLETAS COLUSSI ZUPPALATTE COLUSSI 12/500G ( 8002590045272 )
55062;GALLETAS CHOKIS C/CHIS/CHOCOL CHAROLA 228 GRS.
19944;GALLETAS GULLON CHOCO DIGESTIVEGRS
30659;GALLETAS GAMESA DULCE NAVIDAD180 GR
12671;GALLETAS COLOMBINA MINIESTUCHES OSO NAVIDAD 100G
19946;GALLETAS GULLON BARQUINATAGR
27294;GALLETAS COLUSSI SCINTILLE LATTE UOVA 12/330G
32531;GALLETAS LOC MARIA GAVOTTES BERLINGOTS WAFER BITES FILLED W
28886;GALLETAS DE PASITAS LA PARMIGIANA GR
34128;GALLETAS NABISCO MANTEQUILLA MANI NABISCO 28 GRS
17609;GALLETAS NABISCO RITZ 224 GR
34254;GALLETAS WINMILL L.D.M ALMOND COOKIES 142GR
32586;GALLETAS NOEL COFRE TREN 130G
30561;GALLETAS ALWAYS SAVE VAN SNDWCH 400861
29056;GALLETAS DARE ORIGINAL 125G
30965;GALLETAS DE MANTEQUILLA COOKIE
28914;GALLETAS PUIG MINI MARIA 200G
33770;GALLETAS COOKIES UNITED DULCES SIMPLES
25889;GALLETAS NOEL 220G NOCHE BUENA BS.
1787;GALLETAS POZUELO TENTACIONES HEXAGONAL MANTEQUI 150G
17319;GALLETAS MINI MARIA
30434;GALLETAS GAMESA CHOKIS CHOCOBLANCO CHISPAS 10/12U ( 7702189052452 )
32477;GALLETAS NOEL COFRE VIDRIO 80 GR
32307;GALLETAS ARCOR CON AVENA Y MANZANA CEREAL MIX
30884;GALLETAS RITZ REGULAR SALADA PAQ. 24/268. ( 7622300116507 )
25887;GALLETAS POZUELO NOEL BOLSA NAVIDAD 150G
30942;GALLETAS PASCUAL CRISP SABOR HAMBURGUESA
20567;GALLETAS COLUSSI CRACKERS RIDOTO CONT 10/500G
27539;GALLETAS LIGO DANISH STYLE LIGO BUTTER COOKIES 24/150
10111;GALLETAS DIET RADISSON TORTITAS ARROZ INT BIO 130G ( 8412224041240 )
30558;GALLETAS ALWAYS SAVE ASST SAND CK 869065
26105;GALLETAS POZUELO NOEL BOLSA NAVIDAD 150G
27207;GALLETAS ELLEDI POKER LAGO WAFER VAINILLA 5PCK 45GR
3360;GALLETAS RELENAS MAPLE
32165;GALLETAS SUGAR WAFERS
20743;GALLETAS BIMBO PRINCIPE VAINILLA 145 GR
27345;GALLETAS NESTLE FITNESS INTEGRAL 234 GR
26214;GALLETAS BAKERS BATCH DULCES OTROS 454 GR
26107;GALLETAS NOEL NOCHE BUENAS 220 GR
3776;GALLETAS NABISCO OREO CARAMELO 12U
17567;GALLETAS PUIG DELICIAS MARIA CHOCOLATE 136 GR
30594;GALLETAS BIMBO TRIKITRAKES 51 GR
30461;GALLETAS MISURA NATURA RICCA INTEGRALI 12PC 230GR ( 8002590048310 )
30332;GALLETAS PASCUAL SUPER SANDWICH LIMON PASCUAL PAQ
30625;GALLETAS PUIG MARIA Y CHOCOLATE 133
25907;GALLETAS ITAMARATY WAFER STRAWBERRY FLVOR G
8585;GALLETAS DULCES NAVIDAD COLOMBINA
20971;GALLETAS CHOKIS BLACK GAMESA 63 GR
8462;GALLETAS COLOMBINA NAVIDAD 140 G TARROS COCIN.NAVID140G-172448
19238;GALLETAS PASCUAL SORBETO FRESA INDIVIDUAL
57131;GALLETAS GAMESA DULCE NAVIDAD MANTEQ 180G
9146;GALLETAS QUAKER AVENA MANZANA CANEL 152 GR
30571;GALLETAS ALWAYS SAVE GINGR SNP BX 357392
28936;GALLETAS NOEL PLEGADIZA DETALLE 150
20492;GALLETAS PASCUAL SORBETO FRESA 372 GR
30489;GALLETAS DIET RADI SALVADO AVENA 15/220G ( 8412224019850 )
30773;GALLETAS GAMESA CHOKIS SANDWICH CHOCOBLANCO 456G
32154;GALLETAS KELLOGS SNACK N/CHEEZ CRACKER 1/5/4.7 OZ. ( 21000000654 )
32565;GALLETAS POZUELO BOLKITAS LIMON 36G
29173;GALLETAS DYNAS MARIA 15G
30565;GALLETAS ALWAYS SAVE PFG GRAM CKY 240788
30559;GALLETAS ALWAYS SAVE CHOC SAND CK 200857
30573;GALLETAS ALWAYS SAVE VAN WFR BOX 364372
32425;GALLETAS BIMBO CANAPINAS 95 GR
34130;GALLETAS NABISCO MIEL MINI TEDDY GRAHAMS 28 GRS
29247;GALLETAS COLOMBINA SURTIDAS 200 GR. NAVIDEÑAS
21898;GALLETAS LAS DELICIAS DANISH 340G DELIGHT
17568;GALLETAS PUIG DELICIAS MARIA CHOCOLATE FAMILIAR 272 GR
30719;GALLETAS PASCUAL CRISP SABOR A HAMBURGUESA 37G
32647;GALLETAS DIBELLA BLUEBERRY LEMON 11OZ
30717;GALLETAS AMARETTI SERENATA WAFERS 11 GR
28763;GALLETAS GHIRARDELI 3LB CHOC CHIP ( 747599613746 )
20772;GALLETAS POZUELO BOKITAS CLUB EXTRA ORIG PAGUE 9 LLEVE 12 ( 7441163409683 )
30574;GALLETAS ALWAYS SAVE ICED OTML BX 408898
30657;GALLETAS NOEL FESTIVAL FRESA EXTRAC 403 GR
30575;GALLETAS ALWAYS SAVE MACARDON OKY 848663
30661;GALLETAS CHOKIES SANDWICH CHOCOBLANCO -
11657;GALLETAS PEPPERIDGE FARM GOLDFISH COLORS 6.6 ONZ PEPPERID
34675;GALLETAS NOEL SALTIN BOLSA 24 9 19GRS.
18852;GALLETAS PEPPERIDGE FARM GOLDFISH COLORS 6.6 ONZ PEPPERID
47490;GALLETAS ART ORIG 100 GR 185060
25819;GALLETAS ROYAL DANSK COOKIES WHITE CH. & RASP.
25891;GALLETAS NOEL COFRE OCTAGONAL DE 260GR
27159;GALLETAS MILTONS CRACKERS GLUTEN FREE MULTI 12 4
3443;GALLETAS QUAKER GRANOLA 192 GR. MULTIPACK 4 UND
28782;GALLETAS NOEL 220G SANTIN QUESO HOLANDES
3751;GALLETAS GAMESA CHOKIS 5 PACK 12 185 GR
32282;GALLETAS MARINELA ECONOPACK DE LORS 400 GRS
32261;GALLETAS DANESITA SWISS ROLLS
32289;GALLETAS TASTY CHOICE T CHOICE DE MIEL GRS.
22470;GALLETAS POZUELO GAL.CANASTA GUAYA.
6564;GALLETAS RITZ BITS CHEESE 28 GR UNIDAD
10818;GALLETAS ARTESANAS CON COCO 10 0GR
17538;GALLETAS LEMON CREAM CUETARA 33GR
18035;GALLETAS EL CORTE INGLES CHOCOLATE N 150G
30726;GALLETAS DARE CHOCOLATE 290G
27349;GALLETAS NOEL FESTIVAL RECREO 336 GR
18036;GALLETAS EL CORTE INGLES CHOCOL B 150G
10411;GALLETAS QUAKER AVENA PASAS 152 GR
32470;GALLETAS OREO LIMON 36GR
28657;GALLETAS OREO CREME CONVENIENCE PACK 5.25 OZ
30783;GALLETAS LENNY AND LARRYS CRUNCHY CHOCO CHIP 4 25 OZ
10410;GALLETAS QUAKER AVENA GRANOLA 152 GR
27663;GALLETAS TOP 2 15G
30563;GALLETAS ALWAYS SAVE CHOC FDG CKY 869107
32794;GALLETAS DANISH WALLY LATA 114G
29215;GALLETAS SAN JORGE RELLENITA VAINILLA GN 5 X 8 PCK
3725;GALLETAS POZUELO BOKITAS POZUELO 362G RANCH RELLENAS
31875;GALLETAS TRIGO RED GRASA
10675;GALLETAS MY MOTTO HAZELNUT 20G
6076;GALLETAS COLOMBINA SOLDADO S 140 GR. NAVIDAD
19891;GALLETAS MARIA SABOR A VAINILLA 252 GRS
32479;GALLETAS NOEL LIBRO 117 GR
22695;GALLETAS VITARELLA SALTVIP TRADICIONAL 36/156GR
3703;GALLETAS POZUELO BOKITA CLUB INTEGRAL PAQ.9 225G
19758;GALLETAS THE COMPLETE LENNY AND LARRYS COOKIES LIMON 16OZ
30852;GALLETAS PAPADOPOULOS MINI BISCO CHOCOLATE COOKIESGRS.
9161;GALLETAS BACK TO NATURE MLT SEE RICE 12 4OZ
19759;GALLETAS THE COMPLETE PROTEIN DOBLE CHOCOLATE ( 787692835331 )
29391;GALLETAS OCTOBER FIFTH BAKERY DE AJONJOLI 156G
46877;GALLETAS BIMBO SANISSIMO GALLETA ARROZ QUINUA SAL 108G ( 7441029519211 )
20741;GALLETAS BIMBO PRINCIPE LIMON 145 GR
21890;GALLETAS DANISH NUTRIMEALS 80G TIPO DANESAS
16963;GALLETAS LECOURS VANILLAS CLASSIC WAFERS 11OZ
51212;GALLETAS ARTESANAS NARANJ.100G
32392;GALLETAS PASCUAL BUSITO ESCOLAR NAP.
17513;GALLETAS GAMESA EMPERADOR VAINILLA +2 GRATIS 52/91GR ( 7500478016167 )
13639;GALLETAS KELLOGS CHEEZ IT UND 42GR
32508;GALLETAS PEPPERIDGE FARM D CHOCOLATE COCO MANI
27319;GALLETAS BUSD BEST TEDDY BEARS 198 GR
30384;GALLETAS DANESITA CRACKER WITHOUT SALTGR
21622;GALLETAS QUAKER AVENA FRUTOS 152 GR
19497;GALLETAS MCVITIES GO AHEAD YOG STRAWBERRY 178GR
19254;GALLETAS PASCUAL CLUB ORO INTEGRAL 9PACK
27290;GALLETAS PASCUAL NUTREX BRAN FRUTOS ROJ
16564;GALLETAS TABLE WATER W SESAME CARR'S G
30893;GALLETAS WINDOW
30313;GALLETAS NABISCO MINI VARIETY PACKOZ
15222;GALLETAS DARE CRACKERS 125G
26171;GALLETAS LOC MARIAGAVOTTES CIGARETTE ET EVENTAIL DENTELLE
20963;GALLETAS PIRUCREAM COCO LATA CHICA 155G
32475;GALLETAS NOEL COFRE TREN 130 GR
28911;GALLETAS PUIG MARILU VAINILLA 216G
17552;GALLETAS NESTLE SAVOY SUSY MAXI 50G
27193;GALLETAS NOEL FESTIVAL RECREO
6560;GALLETAS RITZ BITS C QUESO PACKS 13 ONZ
10759;GALLETAS COLOMBINA MOMENTS MORA 135G
17480;GALLETAS PIRUCREAM COCO 300 GR
32530;GALLETAS LOC MARIA GAVOTTES CREPE DENTELLE CHOCOLAT AU LAIT
16752;GALLETAS ST MICHEL BISCUIT 120G COCO
30432;GALLETAS NOEL
8999;GALLETAS CHOKIS BANDEJA PACK 228GR
11229;GALLETAS DARE LEMON 290G
30597;GALLETAS POZUELO BOKITAS RANCH 362G 10U
27655;GALLETAS ROYAL DANSK COOKIES CHOC. CHIPS 100GR
27312;GALLETAS DANISH 340G
53171;GALLETAS NABSICO RITZ PAQUETE 259.2G
1769;GALLETAS POZUELO TOSH COCO Y ALMENDRAS 202 5 G
29222;GALLETAS OLSON SALADA QUESO/CREM 135 GR
29127;GALLETAS GAMESA CHOKIS CHOCOAVELLANA 456G
27540;GALLETAS SAN JORGE RELLENITA LIMON GN 5 X 8 PACK
15810;GALLETAS PEPPERIDGE DOUBLE CHOCOLATE MILANO 7.5 ONZ
33925;GALLETAS MARINELA LORS 4 PZS 192 GR
30502;GALLETAS CRUNCHMASTER ROASTED VEGETABLEOZ
30572;GALLETAS AWG BRANDS SAVE CHOC CHP BOX 363507
15550;GALLETAS VINCENSI AMARET TOSTADAS 300 GR 50201
32202;GALLETAS PASCUAL NO DISPONIBLE ( 052577024033 )
30330;GALLETAS PASCUAL KING FRESAUNIDADES
28661;GALLETAS NABISCO OREO COOL MINTOZ
29058;GALLETAS DARE WATER 125G
2009;GALLETAS POZUELO TOSH PESTO DE ALBAHACA Y OLIVA
30767;GALLETAS OREO OREO CARAMELO 36G
27543;GALLETAS ROYAL DANSK COOKIES BUTTER MINI 15U 200 GR
18028;GALLETAS EL CORTE INGLES CHOCO CHIP 225G
21828;GALLETAS OREO 14.3 OZ
25820;GALLETAS ROYAL DANSK COOKIES DARK CH.&ORANGE 250GR.
30562;GALLETAS ALWAYS SAVE DPLX SAND CK 869081
3446;GALLETAS QUAKER D.AVENA C.PASAS
28696;GALLETAS BUTTER COOKIES
17478;GALLETAS BUDS BEST GINGER SNAPS 340 GR
17563;GALLETAS PUIG MARILU CHOCOLATE 216 GR
28738;GALLETAS ALMONDINA COOKIE BISCUIT ALMOND OZ
21740;GALLETAS DYNAS ORIGINAL 200 GR
28779;GALLETAS NOEL NAVIDAD SALTIN 16OZ
51077;GALLETAS ELLEDI GASTONE LAGO WAFERS CAPPUCCINO 250 GR. ELLEDI
27347;GALLETAS NESTLE MILO NESTLE 408G SANDWICH
32679;GALLETAS LIGO DANISH STYLE LIGO BUTTER COOK 12/454 G
20766;GALLETAS POZUELO BOKITA CLUB INTEGRAL 225 GR 9PZ
21994;GALLETAS SAN JORGE RELLENITA LIMON 5 X 8 PACK
29051;GALLETAS J HIGGS CLASSIC CRACKERS WHEAT 9 1OZ
9782;GALLETAS NONNIS BISCOTTI CHOCOLATE NONNIS 943 GR
3498;GALLETAS BIMBO GALLETA ARROZ QUINUA SAL 108 GR
10676;GALLETAS MY MOTTO 20G
26858;GALLETAS OREO DORADA THIN10.1OZ
25892;GALLETAS NOEL 150G PLEGADIZA DETALLE
16753;GALLETAS ST MICHEL BISCUIT PALETS 150G
28935;GALLETAS NOEL FESTIVAL VAINILLA EXTRACON 403 G
28834;GALLETAS KEEBLER CLUB CRACKERS MULTI GRAIN O
20156;GALLETAS CHIPS DELUXE ORIGINAL 15.8 OZ
19403;GALLETAS ROYAL DANSK CHOCOLATE 125G
22012;GALLETAS MARILAN BAUNY 115GR
17569;GALLETAS PUIG KATY VAINILLA FAMILIAR 256 GR 24G
17485;GALLETAS PIRUCREAM 155 G COCO
21068;GALLETAS GOLDEN SELECTION DANESAS 303 GR
26377;GALLETAS NARANJA CUETARA
20034;GALLETAS MRS BECTORS CREMICA 4 VAINILLA 24/12 360GRS ( 8906001380566 )
32201;GALLETAS PASCUAL CLUB PASCUAL INTEG.C/OMEGA 3 32/9 ( 52577013693 )
29099;GALLETAS TIO YEYO TIO YEYO FAMILIAR 600G
27115;GALLETAS SOPHIA'S COCONUT MAC
19974;GALLETAS DIET FINAS ARROZGR
20553;GALLETAS WIBISCO TEA TIME VANILLA 110 GR
27089;GALLETAS LORNA DOONE SHORTBREAD COOKIES CT
28601;GALLETAS CHIPS CHOCOLATE 12U 14.9ONZAS
17887;GALLETAS LENNY & LARRYS KETO PEANUT BUTTER 45G
53105;GALLETAS POZUELO TOSH PESTO ALBAHACA
28801;GALLETAS COLUSSI BISCOTTI SIGNORCIOK 8PC 600GR ( 8002590045227 )
19625;GALLETAS LAS DELICIAS CRUNKIES CHOCOLATE 276G
18031;GALLETAS EL CORTE INGLES GALLETA MANTEQ SURT 454G
21364;GALLETAS POZUELO FESTIVAL RECREO 432 GR
29200;GALLETAS PASCUAL SNAPIES CANELA 3 18 PAQ
18030;GALLETAS EL CORTE INGLES SURTIDO DE 400G
25997;GALLETAS PAPADOPOULOS DULCES 250 GR
29203;GALLETAS PASCUAL SANDWICH 2PACK 12U+AUDIFONO GRATIS ( 52577035954 )
29172;GALLETAS DYNAS MARIE BISCUITS 150G
29207;GALLETAS ROYAL DANSK COOKIES BUTTER 908 GR
26110;GALLETAS NOEL NAVIDAD NOEL COFRE TREN 280 G
3544;GALLETAS OREO WHITE BLUEBERRY 432GR
3076;GALLETAS COLOMBINA NAVIDENA 200 GR
17203;GALLETAS STAUFFRS MULTP F/ANI CHO/BL1.7OZ
19496;GALLETAS MCVITIES GO AHEAD YOG BERRY 178GR
6811;GALLETAS CHOCOLATE VAINILLA GLUTINO 300 G
9166;GALLETAS BACK TO NATURE COOKIES CLASIC
17539;GALLETAS CUETARA ARTESANA JENJIBRE 100 GR
55719;GALLETAS NABISCO CLUB S INTEGRAL LINAZA & MACA
9168;GALLETAS BACK TO NATURE TRIPLE GINGER COOK 12 9OZ
21992;GALLETAS BLACK OUT
17570;GALLETAS PUIG DELICIAS MARIA CHOCOLATE 20G
43993;GALLETAS CLUB MAX
27386;GALLETAS BETTY CROCKER COOKIE CAKE CHOCOLATE 150G
30699;GALLETAS LOC MARIA GAVOTTES CREPE DENTELLE CHOCOLAT AU LAIT
32341;GALLETAS PEPPERIDGE FARM MAUI 8.6 OZ
30391;GALLETAS MILTON'S CHEDDAR BK CRKER GL FRE 12/4.5Z ( 606541803034 )
30472;GALLETAS BACK TO NATURE MADAGAS VAINI 12 9OZ
19553;GALLETAS POZUELO POZUEO BOKITAS CLUB PAQ12 (300G)
17204;GALLETAS STAUFFERS ANIMAL COOKIES ICED 12/11 OZ ( 72320180014 )
9669;GALLETAS NABISCO CHIPS AH REDUC FAT COOKIESOZ
28663;GALLETAS NABISCO WHEAT THINS MULTIGRAIN
30967;GALLETAS BOLSA ON DE VAINILLA VENEZOLA
20765;GALLETAS POZUELO BOKITA CLUB SALADA 225 GR 9PZ
18374;GALLETAS NABISCO TEDDY GRAHAMS CHOCOOZ
30576;GALLETAS ALWAYS SAVE SNICKERDOODL 350601
21197;GALLETAS RITZ SALADAS EXP 22.4 GR
32474;GALLETAS NOEL DUX
18027;GALLETAS EL CORTE INGLES TORTITAS DE MAIZ 140G
46947;GALLETAS GAMA SALADA PAQUETE 192 GRS
29000;GALLETAS BETTY CROCKER COOKIE CAKE CHOCOLATE CHIP
16565;GALLETAS MCVITIES CARRS TABLE WATER PEPPER 12 125 GR
30399;GALLETAS NATURAL SNACKERS JACKS 230GR
30314;GALLETAS NABISCO CHIPS AHOY CHEWY CHOCOFUDGEOZ
30450;GALLETAS LENNY AND LARRYS THE COMPLETE PROTEIN PEANUT BUTTER ( 787692835416 )
30938;GALLETAS PASCUAL KING FRESA 72X44GR.
29390;GALLETAS OCTOBER FIFTH BAKERY DE ALMENDRA 200G
29027;GALLETAS LOC MARIA GAVOTTES CREPE DENTELLE CHOCOLAT NOIR DA
28671;GALLETAS NABISCO OREO BIRTHDAY CAKE OZ
19601;GALLETAS GAMESA FLORENTINAS DULCE LECHE 11/PAQ.4 ( 7452026414201 )
30463;GALLETAS COLUSSI BISCOTTI GRANOLE 8PC 600GR ( 8002590054656 )
15775;GALLETAS PEPPERIDGE FARM GOLDFISH BABY CHEDAR 7.2 OZ
20391;GALLETAS PAPADOPOULOS CAPRICE CLASSIC 400 GR
27311;GALLETAS POZUELO BOKITAS CLUB 300 GR
22005;GALLETAS PASCUAL CREMA SALTINES
21995;GALLETAS SAN JORGERELLENITA VAINILLA 5 X 8 PCK
25778;GALLETAS NABISCO 2CT VTY PK
17841;GALLETAS ARCOR BAGLEY SALADIX JAMON AGUILA 350G
18385;GALLETAS NABISCO MINI OREO BI
26856;GALLETAS OREO CHOCOLAT CREME BANDEJA 432G
53095;GALLETAS POZUELO 225GR CLUB EXTRA
7898;GALLETAS DIET RADISSON TORTITAS ARROZ QUINOA 130 GR.
17198;GALLETAS STAUFFERS W CHEDDAR CHEESE SNACK 12/7OZ ( 72320111766 )
10674;GALLETAS KELLOGS CHEEZ IT CHEDDAR JACK 352G
49510;GALLETAS COLOMBINA 150G BOLSA FELIZ NAVIDAD
21738;GALLETAS DYNAS SALADAS SALTED 284G 3PACK
21165;GALLETAS DULCE MINI OREO REG 40G
21363;GALLETAS NOEL SALTIN NOEL 216G INTEGRAL/PA/9/LLE12
27595;GALLETAS VITARELLA TRELESO CHOCOLATE 130GR.
21366;GALLETAS NOEL FESTIVAL CHOCK 320G
29244;GALLETAS LOACKER GARDENA HAZELNUT 38G
28938;GALLETAS NOEL FESTIVAL COCO 403 GR
27322;GALLETAS GAMESA EMPERADOR COMBINADO 66-81G
21367;GALLETAS NOEL PACK FESTIVAL VAINILLA-RECREO
21746;GALLETAS DYNAS FRESA 200G
21749;GALLETAS DYNAS PINA 200G
19776;GALLETAS ITAMARATY ATREVIDOS RELL CHOCO BLA 30/90GR ( 7891340365279 )
28871;GALLETAS PASCUAL ONIX X8 PTES.
19970;GALLETAS GULLON AVELLANA AVE CHOC 8/220G ( 8410376042894 )
29212;GALLETAS LOACKER 45G CLASSIC VANILLA
30469;GALLETAS BACK TO NATURE QUESO CHED
28574;GALLETAS PEPPERIDGE FARM SWEET&SAVORY GOLDFISH 45CT ( 14100047315 )
21991;GALLETAS SAN JORGE SODA GOURMET 12 X 6 PACK
29248;GALLETAS SAN JORGE MUNICION
27500;GALLETAS DUKES COCOA CREAMS 24CU
28939;GALLETAS NOEL SALTIN QUESO HOLANDES 220 GR
17892;GALLETAS LENNY AND LARRYS CRUNCHY DOBLE CHOCOLATE
30471;GALLETAS BACK TO NATURE DAR CHOC.
21750;GALLETAS DYNAS PREMIUM CREAMZ CHOCOLATE 100G
30316;GALLETAS OREO NABISCO LB.
21628;GALLETAS VITARELLA SORBETO CHOCOLATE VITARELLA 24 X 120 G
20514;GALLETAS PASCUAL SORBETO CHOCOLATE 372G
7668;GALLETAS OREO ROLLO FRESA 126G
22696;GALLETAS VITARELLA TRELESO POWER VAINILLA 30/78GR
28882;GALLETAS BIMBO MARISELA PRINCIPE LIMON 6P 252GR
25692;GALLETAS EMPERADOR CHOCOLATE 72GR.
27350;GALLETAS NOEL NAVIDAD NOEL MASON JAR 104 GR
18990;GALLETAS KEEBLERKEEBLER CHIPS DLX SOFT N CHEWY 12/16.4OZ ( 30100122876 )
27558;GALLETAS OLSON DE LECHE 190G
19619;GALLETAS EMPERADOR VAINILLA 36G
28780;GALLETAS NOEL DUCALES NAVIDAD 400G
22597;GALLETAS MOLSA MARIA 204GR
29330;GALLETAS PASCUAL SORBETO PREMIUM
28710;GALLETAS BRAZILIAN BISCUIT DU SURTIDAS
6371;GALLETAS CHEDDAR JACK CAJA CHEZZ
19881;GALLETAS CACAO RELLENAS CON CREMA DE LECH
29136;GALLETAS LENNY AND LARRYS CRUNCHY DOBLE CHOCOLATE 4 25 OZ
10757;GALLETAS BRINKY FRESA 300GR
30311;GALLETAS NABISCO NILLA WAFERS REDUCED FAT OZ
11235;GALLETAS OREO 40G MINI
22013;GALLETAS MARILAN TOSTADA TORRADA
19709;GALLETAS NOEL SALTIN DOBLE FIBRA
29266;GALLETAS QUEST PROTEIN COOKIE CHOC. CHIP 59 G.
18032;GALLETAS EL CORTE INGLES GALLETA RELLE CHOCO 500G
17891;GALLETAS LENNY AND LARRYS CRUNCHY CHOCOLATE CHIP
9670;GALLETAS OREO RED FAT 14.30 OZ 325900
17197;GALLETAS STAUFFERS MULTP SALD/QUE/CH1.5OZ
26006;GALLETAS DULCES OTROS 454 GR
28672;GALLETAS NABISCO CHIPS HOY THIN CINN SUG 12/7OZ ( 44000049140 )
27189;GALLETAS DELEITE CHOCO AVELLANA 10/12/9GR ( 7702011276162 )
20515;GALLETAS PASCUAL SORBETO LIMON 372G
22629;GALLETAS POZUELO CLUB XTRA INTEGRAL 225 GR
21736;GALLETAS DYNAS MINI CRACKERS (SALTED) 227G
20361;GALLETAS NAVISCO 182Z CA COOKIE ORIG 12
18034;GALLETAS EL CORTE INGLES C CHOCOL L 150G
19613;GALLETAS BUDS BEST CANDYS COOKIE 2.125OZ ( 745527100269 )
30607;GALLETAS 4 PACK FLORENTINA- 332 GR
26108;GALLETAS POZUELO FIG MUNECO NIEVE 160 G
22689;GALLETAS VITARELLA MARIA TRADICIONAL 20/400GR
3496;GALLETAS MARINELA RELLENA D/MOUSE 210 GR D/LIMON
18029;GALLETAS EL CORTE INGLES SURTIDO NAVIDAD 700G
52509;GALLETAS COMBO ESPECIAL LA PARMIGIANA
29243;GALLETAS RITZ 22.4 G AJO MANTEQUILLA
30593;GALLETAS BIMBO SANISIMO SALMAS PROMO MAS SALMITA 325GR
29223;GALLETAS OLSON ROLLO OCTOBER 72 GR
15811;GALLETAS PEPPERIDGE CHESSMEN 206G
22036;GALLETAS SAN JORGE SODA GOURMET GN 12 X 6 PACK
18317;GALLETAS SHOPPERS VALUE C/CREMA VARIA25OZ
18904;GALLETAS NABISCO 1.7OZ
20027;GALLETAS MAFAM MINI NUTRICHIPS 25G ( 873617002787 )
20036;GALLETAS MRS BECTORS CREMICA RIO 4 FRESA 24/12 360GRS ( 8906078260846 )
28730;GALLETAS FIG BARS D RAYSONZAS
17889;GALLETAS THE COMPLETE PROTEIN COOKIE CHOCO CHIP ( 787692834617 )
47048;GALLETAS COLOMBINA GTA YOGUR Y ACAI 12/6/23GR ( 7702011277084 )
22519;GALLETAS MAX QUESO 408G.
27124;GALLETAS INDEFINIDA BETTER VALU CHOCO CHIPS COOKIESOZ
28744;GALLETAS BIMBO CRAKERS DOBLE FIBRA 192 GR
22026;GALLETAS MARINI SAVOIARDI AL CACAO
21557;GALLETAS VITARELLA RELLENA FRESA VITARELLA TRELOSO
7265;GALLETAS MARIN PRINCIPE CHOC BLANCO 210GR
10672;GALLETAS DUO BACON&CHEDDAR CHEZZ
29211;GALLETAS LOACKER 45G CLASSIC HAZELNUT
20507;GALLETAS CLUB ORO INTEGRAL 306 GR
22018;GALLETAS MARILAN WAFER VAINILLA
19708;GALLETAS NOEL SALTIN QUESO MANTEQUILLA
57146;GALLETAS COLOMBINA 200 G LATA GLOBO NAVIDAD
20362;GALLETAS NABISCO CHIPS AHOY CAJA 516G
8789;GALLETAS CHEDDAR GROOVES BOLSA CHEZ
9675;GALLETAS TEDDY GRAHAMS CINAMON
17514;GALLETAS GAMESA EMPERADOR COMBIANADO 91GR.
17435;GALLETAS GAMESA CREMAX 4PACK VAINILLA
6561;GALLETAS NABISCO CHIPS AHOY MINI CHOC 28G
30656;GALLETAS NOEL FESTIVAL FRESA
30470;GALLETAS BACK TO NATURE OATMEL
20960;GALLETAS BUDS BEST INGER SNAPS 340GR
25923;GALLETAS SCHAR BISCOTTI CON CIOCCOLATO 6/150GR ( 8008698005347 )
21997;GALLETAS SAN JORGERELLENITAS VAINILLA 5X8 PCK
21878;GALLETAS PASCUAL 156G CRISP FINA/HIERBAS 6PAC
21893;GALLETAS DANISH PRIDE DELIGHT 340G
11651;GALLETAS PEPPERIDGE FARM SAL GOLDFISH ORIG 187G
21567;GALLETAS VITARELLA TRELOSO FRESA VITARELLA 35 GR
29363;GALLETAS ROYAL DANSK COOKIES BUTTER TIN 8X681GR.
47043;GALLETAS COLOMBINA 200 G SURTIDAS
28691;GALLETAS MOON PIE CHOCOLATE ( 72108248011 )
19524;GALLETAS LAS DELICIAS WAFER CHOCO 24/168G ( 603554023114 )
26231;GALLETAS NOEL NAVIDAD NOEL 300G VILLA
27697;GALLETAS VITARELLA SALTVIP QUESO 36/156GR.
28835;GALLETAS KEEBLER CHIPS DELUXE CHOC CHUNK COOK 14.9 OZ
33490;GALLETAS UNCLE ALS ICED OATMEAL 5OZ
18905;GALLETAS KELLOGS CHEEZ IT DUOZ CHEDAR 12.4OZ
20866;GALLETAS VAINILLA C CHISPA G PARMIGIANA
28665;GALLETAS NABISCO RITZ REDUCED FAT OZ
27223;GALLETAS SALUDABLES FANCYPANTS
17893;GALLETAS LENNY AND LARRYS CRUNCHY CINNAMON
29246;GALLETAS LOACKERS GARDENA HAZELN/WHITE 38G
30297;GALLETAS LA MODERNA MARIAS 12/600GR ( 38629000101 )
30397;GALLETAS MICRO STEPS DULCES ALM Y JEN
20801;GALLETAS SAND DUKES CHOCO-VAINILLA 40 G
3497;GALLETAS BIMBO GALLETA ARROZ INTEGRAL 108 GR
30641;GALLETAS RITZ 22.4 G AJO MANTEQUILLA
30854;GALLETAS PASCUAL ANIMALITOS ZOO PAS
47045;GALLETAS GAL.SANDWICH YOG.GRIEGO 6U/138G *12
20392;GALLETAS AMARETTI BINGO GRS
27323;GALLETAS GAMESA CHOKIS DULCE DE LECHE 57 GR
20393;GALLETAS AMARETTI BINGO GRS
20728;GALLETAS MARIN PRINCIPE CHOC BLANCO 210GR
7830;GALLETAS WAFER RICH MAXI VAINILLA 450 G
22611;GALLETAS BAUDUCCO WAFER CHOCOLATEGR
30890;GALLETAS OTROS MANTEQUILLA CROCANTES
20980;GALLETAS EMPERADOR VAINILLA 91 GR
21993;GALLETAS SAN JORGE RELLENITA FRESA 5 X 8 PCK
27541;GALLETAS SAN JORGE RELLENITA FRESA GN 5 X 8 PCK
19554;GALLETAS POZUELO CLUB EXTRA PROMO 300G
19710;GALLETAS NOEL FESTIVAL PACK VAIN RECR+VASO GRT ( 7702025144020 )
20555;GALLETAS WIBISCO TEA TIME CHOCONILLA 110 GR
30329;GALLETAS PASCUALKING VAINILLA 3 24 75 GRS
22010;GALLETAS MARILAN WAFER CHOCOLATE
9674;GALLETAS NABISCO TEDDY GRAHAMS CHOCOLATE 10 OZ
21996;GALLETAS SAN JORGERELLENITAS LIMON 5X8 PCK
19457;GALLETAS GARDEN FORTURE COOKIES 210G
25832;GALLETAS ST MICHEL GALLETA CHOCOLATE 12/121GR ( 3178530417241 )
26232;GALLETAS NOEL NAVIDAD 120G
10400;GALLETAS BIMBO PRINCIPE LIMON 145G
28781;GALLETAS NOEL NAVIDAD MASONJAR104G
21368;GALLETAS NOEL FESTIVAL CHIPS 240GR
59704;GALLETAS BEST DAPI VAINILLA 274 GRS
7687;GALLETAS COLOMBINA RELLENO CHOCO 135G
21745;GALLETAS DYNAS CHOCO 200G
18988;GALLETAS CHIPS ORIGINAL 12 U 15.8 ONZAS
17486;GALLETAS PIRUCREAM COCO DISPLAY 24G
25803;GALLETAS LUNDBERG WILD RICE CAKES 12 8 5 OZ
3775;GALLETAS NABISCO RITZ AJO MANTEQUILLA 134.4G-173778
30855;GALLETAS PASCUAL CREMAS SANDWICH 12U
18375;GALLETAS NABISCO MINI CHIPS A
30862;GALLETAS COOKIES BUTTER POSTCARD
27362;GALLETAS MARIA SABOR A VAINILLA 252 GRS
19992;GALLETAS MSUPFOODS CHOCO HEROES GALLE 6/6.25OZ ( 851893004039 )
21968;GALLETAS EMPERADOR CHOCOLATE 36G.
7833;GALLETAS SALADA COCKTAIL EXTRA 225 G
61071;GALLETAS HIGHKEY MINI NO SUGAR 6/2 OZ
30560;GALLETAS ALWAYS SAVE LEMN SAND CK 869073
17484;GALLETAS PIRUCREAM ORIGINAL MULTIPACK 144G
19878;GALLETAS SCHAR SALTI 5/175GR ( 8008698002049 )
20508;GALLETAS PASCUAL CRISP FINAS HIERBAS 156 GR
15820;GALLETAS KELLOGS PARMESAN CHEDDAR 351GR
21741;GALLETAS DYNAS CEBOLLA 200 GR
22025;GALLETAS MARINI CANTUCCINI BISCUITS WITH ALMON
21569;GALLETAS VITARELLA C/CREMA CHOCOLATE VITARELLA 150
56058;GALLETAS NESTLE MILO NESTLE SANDWICH
26057;GALLETAS EMPERADOR VAINILLA 72 GR
46958;GALLETAS NABISCO OREO BIRHTDAYCAKE BOLS 12U PASTEL CUMPL
21751;GALLETAS DYNAS PREMIUM CREAMZ FRESA 100G
19993;GALLETAS MSUPFOODS HONEY HEROES GALLE 6/6.25Z ( 851893004046 )
22033;GALLETAS GULLON VITALDAY AVENA QUINOA LINO 4 PACKS
10743;GALLETAS CUETARA CASERA ARTESANA COCO 330 G
27608;GALLETAS QUEST PROTEIN COOKIE OATMEAL RAISIN FLAV
17512;GALLETAS GAMESA EMPERADOR NOCTURNO + 2 GRATIS 52/91GR ( 7500478016150 )
36638;GALLETAS ITAMARATY SPANTOO GALL FRESA 30/80GR ( 7891340365415 )
36707;GALLETAS PASCUAL CREAM VAINILLA EXHIBIDOR 24/148
20554;GALLETAS WIBISCO TEA TIME CHOCOLATE 110 GR
18397;GALLETAS NABISCO RITZ CRACKERS OZ
36673;GALLETAS DYNAS CRACKER SIN SAL DYNAS 454G
36715;GALLETAS PASCUAL GALLETA DE SODA DOCENA
29249;GALLETAS SAN JORGE CRAKNEL INTEGRAL
22017;GALLETAS MARILAN WAFER MANI
25900;GALLEAS TERRA KARAVANSAY GALL ARROZ INTEGRAL 10/110GR ( 7707357440710 )
28836;GALLETAS KEEBLER SOFT BATCH CHOCOLATE CHIP OZ
28767;GALLETAS SEPROD OVALTIME SNACK COCKIES PACK 12
22016;GALLETAS MARILAN WAFER LIMÓN 115GR
25954;GALLETAS MRS FIELDS DE MACADAMIA
21734;GALLETAS DYNAS MINI CRACKERS (PIZZA) 227G
3545;GALLETAS CLUB SOCIAL INTEGRAL LINAZA 24 GR
47059;GALLETAS CHOC OREO ORIGINAL 6U 324G
29210;GALLETAS LOACKER 45G CLASSIC CHOCOLATE
7832;GALLETAS WAFER RICH MAXI CHOCOLATE 450 G
17320;GALLETAS LA PARMIGIANA 200G NAVIDAD LATA
22677;GALLETAS MUU CREMADA AVENA/BANANO 24/12/33GR ( 7702011070326 )
20046;GALLETAS PEPPERIDGE FARM QUESO GOLDFISH UNIDAD
27696;GALLETAS VITARELLA TRELESO FRESA/FRUTILLA 30/60GR
19428;GALLETAS MURRA S/F SHORTBREAD COOKIES 12/7.7 OZ ( 82011102331 )
26209;GALLETAS LECOURS JUNGLE JAMMERS ANIMAL CRACK 13OZ
19570;GALLETAS RIMITH GINGER SNAPS PACK FAMI 6UN ( 7451002625549 )
25720;GALLETAS KEEBLER CHIPS DLX COCONUT COOKIE 12/11OZ ( 27800100846 )
25804;GALLETAS BEE GINGERBREAD MINI HOUSE 6.75OZ ( 73563016719 )
27286;GALLETAS GO AHEAD YOGURT BREAKS STRAWBE
36660;GALLETAS DANESAS NUTRIMEALS 250G
26154;GALLETAS KEEBLER CUBIERT CHOC FUDG STRIP 326 G
30312;GALLETAS NABISCO HONEY CINNAMON CRISPS OZ
26413;GALLETAS VICTORIA SABOR QUINOA 30G
17088;GALLETAS PASCUAL SORBETO LIMON 372GR ( 52577036364 )
27588;GALLETAS SAN JORGE MULTIGRANO CRACKERS
26344;GALLETAS BAKERS BATCH 6 OZ CHRISTMAS
11407;GALLETAS BIMBO PRINCIPE CHOC.BLANCO 145G
26306;GALLETAS PASCUAL CRISP CON MANJAR DE LECHE 1/24 444G
27288;GALLETAS PASCUAL SANDWICH GRT
18836;GALLETAS EMPERADOR VAINILLA 72G
20981;GALLETAS GAMESA EMPERADOR COMBINADO 91 GR
51019;GALLETAS CRAKEÃ‘AS FIBRA MIEL 12/6/30GR ( 7702011274649 )
27458;GALLETAS NABISCO MONDELEZ OREO BLUEBERRY 36G
27545;GALLETAS LOACKER 38G GARDENA HAZELN/WHITE
