TAG;PRODUCTO
1905;GALLETAS POZUELO TOSH AVENA GRANOLA 156 GR
1718;GALLETAS POZUELO CHIKY CHOCOLATE 12 UND 480 GRS
2021;GALLETAS POZUELO TOSH LIMON TEVERD202,5G
16242;GALLETAS BARILLA MULINO BIANCO BAIOCCHI G
1657;GALLETAS POZUELO SAL CLUB EXT
3416;GALLETAS TA FLRNTNA FRSA MNTQ 332GR
3574;GALLETAS D COSTA LIMON
1979;GALLETAS POZUELO FUSION DE CEREAL 256.5G TOSH
1957;GALLETAS POZUELO BOKITAS RELLENAS CON QUESO BLANCO 24 35
1708;GALLETAS POZUELO COCANA TUBO 150 GRS
7359;GALLETAS GAMESA MULTI PACK CHOKIS VAINILL
7361;GALLETAS QUAKER DE AVENA 48 GR MANZANA CANELA
3421;GALLETAS CUETARA CAMPECHANAS 216 GRM
1984;GALLETAS POZUELO TOSH CHOCOLAT AVE 164,8G
3556;GALLETAS NABISCO CHIPS AHOY REGULAR TUBO 30X143
2153;GALLETAS POZUELO GALLETA TOSH MIEL 12 UNIDADES
7352;GALLETAS GAMESA CHOKIS MIX RELL/CHOC 93
1738;GALLETAS POZUELO TOSH YOGURT ARANDANOS 164 G
1689;GALLETAS POZUELO CLUB EXTRA 12 UN 300 GRS
14327;GALLETAS COLOMBINA PIAZZA BARQUILLOS VAINILLA 45 GR.
2059;GALLETAS POZUELO DEPOSIT CANAST 276 G CHOC 12P
6307;GALLETAS PEPPERIDGE ORANGE MILANO 7 ONZ
3382;GALLETAS POZUELO CREMA Y CHOCOLATE 115 GRS
1686;GALLETAS POZUELO PASIÓN MARACUYA TOSH 164.8G
7357;GALLETAS MINI CHOKIS GAMESA 38
1659;GALLETAS POZUELO MARIA INTEGRAL
1766;GALLETAS POZUELO CHIKY CHOCOLATE X9 60GR
3858;GALLETAS MARISELA PRINCIPE LIMON 85 GR
3424;GALLETAS CUETARA CASERA ARTESANA COCO 330 G
3752;GALLETAS GAMESA FLORENTINA FRESA 83 GR
1857;GALLETAS POZUELO CHIKY COBERTURA CHOCOLATE 320GR
1644;GALLETAS POZUELO MANTEQUILLA 160 GRM
1950;GALLETAS POZUELO CREMA SURTIDA 3X2 438 GR
3687;GALLETAS POZUELO COFRE OCTAGONAL 235GR
3351;GALLETASPEPPERIDGE FARM D CHOCOLATE C LECHE
4315;GALLETAS PRINCIPE LIMON 85G
3375;GALLETAS POZUELO BOKIT RELLENA DE QUESO TUBO 141.5 GR
3786;GALLETAS NESTLE FITNESS BISCUIT RED FRUIT G
1838;GALLETAS POZUELO CANASTA GUAYABA260 GR
10011;GALLETAS NABISCO CHIPS AHOY BI DISP 57GR
9001;GALLETAS EMPERADOR CHOCOLATE 100 GR.
2205;GALLETAS POZUELO TOSH SEMILLAS ANDINAS Y ARAND 156GR
4493;GALLETAS GAMESA CHOKIS CHOKOMAX 360 GR
1920;GALLETAS POZUELO MANTEQUILLA 12 UND 312 GRS
6072;GALLETAS COLOMBINA 220 G BOLSA FELIZ/NAVIDAD
6535;GALLETAS ROLAND CRACKER RICE ORIGINAL 3.5 OZ
6669;GALLETAS POZUELO CHIKY CHOCOLATE 8 UNIDADES (320G
7553;GALLETAS CUETARA MARIA DOCENA 240 GRS
1993;GALLETAS POZUELO NOCHE BUENA PLEGADIZA
3559;GALLETAS SALADAS CLUB SOCIAL 144 GR
1953;GALLETAS POZUELO YUMBO FIBRA 6 UND 180 GRS
2188;GALLETAS POZUELO BOKITAS POZUELO 12UND 233.
3542;GALLETAS NABISCO OREO GOLDEN 432 GR
4386;GALLETAS OREO 30X126G TUBO REG
3540;GALLETAS NABISCO CLUB SOCIAL 234 GRS
11298;GALLETAS MINI LUNCHBOX CHOC OREO 3.5 OZ 321100
2051;GALLETAS POZUELO MARIA 12 UND
3787;GALLETAS NESTLE FITNESS BISCUIT OAT RAISI G
1721;GALLETAS POZUELO SODA INTEGRAL 176 GRM.
3582;GALLETAS MATILDE VICENZI RELL DULCES PARMAL GRISBI 150 G CACAO
16569;GALLETAS MCVITIES INTEGRAL D TRIGO
3548;GALLETAS NABISCO OREO FRESA 432GR
3553;GALLETAS NABISCO BELVITA HONY BRAN 297 GR
10864;GALLETAS MAFAM LIMA LIMON S AZUC.NUT
10739;GALLETAS MANZANA CREAM CUETARA 33GR
3849;GALLETAS KEEBLER TOWN HOUSE CRACKERSONZ.
14766;GALLETAS COLUSSI ACEITE OLIVA 250 GR 017514
11422;GALLETAS PRINCIPE CHOCOLATE 85GR
4335;GALLETAS QUAKER DE AVENA 187 GR PASAS
4081;GALLETAS OREO TUBO 126 GRAMOS
3583;GALLETAS MATILDE VICENZI CREMA DE AVELLANA VICENZI 150 G
10168;GALLETAS CHOCO CHOKIS CHOC 84GR
11456;GALLETAS CHOKIS CHOCO MAX 90GR
4314;GALLETAS MARISELA PRINCIPE CHOCOLATE 85GR
6306;GALLETAS PEPPERIDGE FARM MILANO 6 ONZ
3609;GALLETAS TATES BAKE SHOP WHOLE WHEAT DARK CHOCOLA
2117;GALLETAS POZUELO INT ALBAH TOMAT CHIA TOSH 256.5G
3541;GALLETAS OREO CHOCOLATE 432 GR.
3447;GALLETAS MAFAM NUTRI SNACK DE AVENA INTEGRAL C PASAS LITE 240 GRS
3373;GALLETAS POZUELO BOKITAS TUBO 231 110GRS.
9664;GALLETAS NABISCO DOUBLE OREO
2196;GALLETAS POZUELO BOLS ROJ NAVIDAD 150 GR
3391;GALLETAS POZUELO CANASTA GUAYABA260 GR
16605;GALLETAS PEPPERIDGE FARM GOLDFISH SALADA C/EXTRA QUESO CHEDDAR 6.6 OZ.
7871;GALLETAS GULLON DIGESTIVE DIET NATURE GR
3374;GALLETAS POZUELO BOKITAS POZUELO 12UND 233.
3420;GALLETAS CUETARA MARIA 200 GRM
1829;GALLETAS POZUELO BOKITAS QUESO BLANCO 354 GR
17007;GALLETAS PASCUAL ANIMALITO X UND
2163;GALLETAS POZUELO SODA C ESPECIAS 8.00 UND
1973;GALLETAS POZUELO TOSH MIEL 270 GR
3678;GALLETAS POZUELO TENTACIONES HEXAGONAL MANTEQUI 150G
7262;GALLETAS MARINELA TUBO SABOR VAINILLA 135 GR
3675;GALLETAS POZUELO TOSH YOGURT ARANDANOS 164 G
7899;GALLETAS DIET RADISSON TORTITAS ARROZ INTG S/SAL 8/130 GR ( 8412224041264 )
3784;GALLETAS NESTLE COCOSETTE MAXI WAFER GR
1954;GALLETAS POZUELO RECREO ROLLO 155 GRS
6087;GALLETAS NESTLE MILO SANDWICH COOKIE GR
9666;GALLETAS OREO DOBLE CREMA
6646;GALLETAS POZUELO MARIA 12 UND
3372;GALLETAS POZUELO SODA INTEGRAL 176 GRM.
3584;GALLETAS MATILDE VICENZI RELL DULCES PARMAL 150 G LIMON
10863;GALLETAS MAFAM SUGARFREE CACAO 48 GR
14767;GALLETAS COLUSSI SIN SAL 250 GRS 017521
3558;GALLETAS SALADAS CLUB SOCIAL 288 GR
6795;GALLETAS BIMBO SALADA DE MAIZ SANISSIMO 140 GR
16655;GALLETAS F ONE BROWNIES CHOC CHIP COOKIE 25 GR
1938;GALLETAS POZUELO RELLENA CHOCOLATE Y VAINILLA PAQ 1 DZ
3388;GALLETAS POZUELO MANTEQUILLA 160 GRM
3610;GALLETAS TATES BAKE SHOP OATMEAL RAISIN COOKIES
6311;GALLETAS PEPPERIDGE FARM SAL GOLDFISH ORIG 187G
3762;GALLETAS NABISCO CLUB SOCIAL 234 GRS
14686;GALLETAS CUETARA KRIT SALADA REDONDA 288 GRS
3695;GALLETAS POZUELO TOSH SEMILLA ANDINA 24/156GR ( 7441163405739 )
10237;GALLETAS GAMESA INTENSO FRESA 94 GR
17052;GALLETAS PASCUAL SORBETO CHOCOLATE 26 GR
17016;GALLETAS PASCUAL CHOCO CREAM
7787;GALLETAS MOLI ESCOLAR FRESA 12 UND
19336;GALLETAS SOPHIA'S SANDWICH DU
16749;GALLETAS KEEBLER CLUB MULTI-GRAINONZAS
13850;GALLETAS POZUELO INT TOSH MIEL POZUELO 30G
17013;GALLETAS PASCUAL SANDWICH PASCUAL VAI
6642;GALLETAS POZUELO CREMA SURTIDA 3X2 438 GR
10243;GALLETAS FAMOUS DE CHOCOLATE CHIP 4
3785;GALLETAS NESTLE FITNESS BISCUIT HONEY G
16199;GALLETAS SORBET CUETARA YOGURT-MELOC PAQ 250 GR
3566;GALLETAS NABISCO OREO COOKIES CREAM 432GR
2011;GALLETAS POZUELO SODA CAJA 432 GR
11650;GALLETAS PEPPERIDGE FARM MILANO 6 ONZ
2190;GALLETAS POZUELO CLUB EXTRA INTEGRL 225GR
1985;GALLETAS POZUELO SODA 176GRS PAQ 8 UND
7873;GALLETAS GULLON DIGESTIVA DE AVENA
5267;GALLETAS MARINELA SPONCH SMORE 90GR
8852;GALLETAS POZUELO SODA C ESPECIAS 8.00 UND
2034;GALLETAS POZUELO CHIKY ROLLO 153 GR 1 UND
3567;GALLETAS NABISCO CLUB SOCIAL INTEGR 234GR
16945;GALLETAS NOEL SODA TACO NOEL 200 GRAMOS
15517;GALLETAS BAUDUCCO MAXI CHOCOLATE 13GR
17015;GALLETAS PASCUAL SODA 40 8
11482;GALLETAS BELGIAN ESTILO WAFFLES BELGIAN BUTTERS
1959;GALLETAS POZUELO TOSH AJONJOLI 251 GR
15561;GALLETAS GULLON ACTIVE INTEGRAL GR
16566;GALLETAS MC VITIES AHEAD APPLEGRS.
19767;GALLETAS ITAMARATY WAFER OBSESSIONGR
3393;GALLETAS POZUELO TOSH AJONJOLI 251 GR
17018;GALLETAS PASCUAL CREMA SALTINES JR GR
7789;GALLETAS MATILDE VICENZI DE ALMENDRA MOLIDA VICENZI 100 G
5467;GALLETAS POZUELO CHIKY CHOCOLATE X9 60GR
6582;GALLETAS VOORTMAN WAFER VAINILLA S AZUCAR 255 GRS
7362;GALLETAS QUAKER DE AVENA 48 GR C PASAS
10374;GALLETAS COLOMBINA BRINKY CHOCOLATE 300GR
9140;GALLETAS MATILDE VICENZI CANTUANI C ALM
17073;GALLETAS PASCUAL MARIA SUGAR FREE EN DOC 300GR
17002;GALLETAS PASCUAL SANDWICH CHOCOLATE 36 4
17046;GALLETAS PASCUAL CREMA VAINILLA 24 62GR
7737;GALLETAS CEREAL FIBRA CLASICA 135 GRS
3369;GALLETAS POZUELO SODA CAJA 432 GR
3394;GALLETAS POZUELO TOSH MIEL 270 GR
16806;GALLETAS FILET BLEU SABLE AU CITRON 12/150G ( 3556940811659 )
16561;GALLETAS CRAKERS B.S CARRS
16899;GALLETAS ROLAND LADY FINGERS ROLAND 100GRS
3387;GALLETAS POZUELO MANTEQUILLA 12 UND 312 GRS
17132;GALLETAS WIBISCO TEA TIME VANILLA BISCUIT
17604;GALLETAS NABISCO OREO GOLDEN EXP 36 GR
7836;GALLETAS MOLSA WAFER RICHE FRESA
12686;GALLETAS ROYAL DANSK DANESA LATA EA 12 OZ
7892;GALLETAS DIET RADISSON BARQUILLOS RELLENOS SABOR COCO 200 GR S AZUCAR
9172;GALLETAS D DELICIAS MANZ TE VERDEGRS
20869;GALLETAS SALATI CRISPY 12 PAK
9892;GALLETAS CHOKIS 199G PAKETON TUBO
9176;GALLETAS DIET FRESAS CHCO I G
6661;GALLETAS POZUELO CHIKY CHOCOLATE 12 UND 480 GRS
7841;GALLETAS MOLSA SALITAS SODA 8 UND 160 GRS
14233;GALLETAS ROYAL DANSK DANESA LATA EA 12 OZ
17021;GALLETAS PASCUAL SANDWICH DE FRESA 36 4
17510;GALLETAS GAMESA CHOKIS BLACK 48/63GR ( 7500478002344 )
7900;GALLETAS DIET RADISSON TORTITAS MULTICEREALES 8/130G ( 8412224041271 )
7264;GALLETAS MARINELA CANELITA 240GR
8330;GALLETAS NABISCO CHIP AHOY BLACK & WHITE NABISCO 342G
22031;GALLETAS MOLSA KIDDY VAIVAI CHOC 300GR
16954;GALLETAS MCVITIES DIGESTIVE MC.VIT GR
9763;GALLETAS DADDY RAYS FIG BARS 5OZ
9163;GALLETAS BACK TO NATURE ARROZ QUESO 113G
14191;GALLETAS VOORTMAN CHOCOLATE CHIPS 200 GR
17011;GALLETAS PASCUAL SANDWICH CHOCOLATE F
17047;GALLETAS PASCUAL CREAM FRESA EXHIBIDOR 24 1488G
7758;GALLETAS BAUDUCCO SORBETO OBLEA CON RELLENO FRES
9152;GALLETAS MOLSA WAFER NARANJA
15701;GALLETAS PRINCIPE CHOC BLANCO 8P MAR
17141;GALLETAS DADDY LOW FAT APPLE BARSOZ
6951;GALLETAS COLOMBINA PIAZZA BARQUILL 147G
3573;GALLETAS COSTA CHOCOCHIPS 125 GRS
19347;GALLETAS SOPHIAS GINGER SNAPSOZ
17638;GALLETAS LOACKER PIERRE MIXED BERRIES 5
16090;GALLETAS CUETARA SURTIDA NAVIDENA LATA 300GR
15516;GALLETAS BAUDUCCO SABOR LECHE BAUDUCCO 24 112GRS
10841;GALLETAS SODA CUETARA 8PAQT 200GR
9177;GALLETAS DIET RADISSON TORTITAS MAIZ BIO 135 GR
13844;GALLETAS POZUELO INTEGRAL
16931;GALLETAS NABISCO MINI CHIPS AHOY MULTIPACK 12 OZ
16775;GALLETAS WASA CRISP'N LIGHT CRACKER OZ
9162;GALLETAS BACK TO NATURE SESAME RICE
4334;GALLETAS QUAKER DE AVENA 187 GR GRANOLA
17072;GALLETAS PASCUAL CREMAS SALTINES MANTEQ.48181G
17240;GALLETAS POZUELO TOSH ALBAHACA TOMATE CHIA 1 OZ
13848;GALLETAS POZUELO YUMBO FIBRA
20477;GALLETAS PASCUAL MANTEQUILLA DOC 360 GR
6649;GALLETAS POZUELO YUMBO FIBRA 6 UND 180 GRS
9668;GALLETAS RITZ CRACKERS HINT OF SALT 13.7 OZ
4048;GALLETAS CREMAX DE NIEVE CHOCOLATE 68GR
17700;GALLETAS WAFER CHOCOLATE COLOMBINA 151G
3377;GALLETAS POZUELO CLUB EXTRA 12 UN 300 GRS
19349;GALLETAS SOPHIA'S MINI CHOCOLATE CHIP PEC 12/8 OZ ( 73124507519 )
17094;GALLETAS J D DE ALMENDRA GRAMOS
17096;GALLETAS J D WAFFLE MANTEQUILLA GRS
19307;GALLETAS M&M BITE SIZEOZ.
8851;GALLETAS KEEBLER MURRAY VAINILLA SUGAR FREE 9 ONZ
19330;GALLETAS SOPHIAS COOKIES ICED
22319;GALLETAS PASCUAL SALTINES COCKTAIL
15021;GALLETAS CREMAX DE NIEVE VAINILLA 68GR
17031;GALLETAS PASCUAL JENJIBRE FAM
22640;GALLETAS CHISPA DE CHOCOLATE
10698;GALLETAS SORB AVELL 10U COLOMBINA 300G
8848;GALLETA SABOR SUAVE QUESO SNYDE
16955;GALLETAS MCVITIES LIGHT DIGESTIVEGRS
9665;GALLETAS NILLA WAFERS 311GR
10012;GALLETAS NABISCO CHIPS AHOY BLACK WHITE 114 GR
17012;GALLETAS PASCUAL SANDWICH COMBINACION
20008;GALLETAS DAELMAN CARAME JUMBO WAFERS 8 10.94 OZ
17719;GALLETAS POZUELO NOEL CRACKER SALTIN UND
11381;GALLETAS PEPPERIDGE CHESSMEN 206G
14765;GALLETAS COLUSSI SALADA 250 GR 012915
11373;GALLETAS GAMESA CHOKIS SABOR CHOCOLATE 63 GR
10697;GALLETAS FLORENTINA FRESA MANTEQ 4PK 332G
6089;GALLETAS NESTLE LA LECHERA SANDWICH 24 36.4GRS
15244;GALLETAS BARILLA MULINO BIANCO CUORICINNI G
11307;GALLETAS POZUELO COCANA TUBO 150 GRS
16774;GALLETAS WASA LT RYE CRISPBREADOZ
20461;GALLETAS PASCUAL MINI CHOCO CHIPS PACK GR
10715;GALLETAS MARINELA PRINCIPE CHOCOLATE 85GR
10741;GALLETAS SORBETO CUETARA VAINILLA 300G
17005;GALLETAS PASCUAL SAND LIMON X UND GR
17062;GALLETAS PASCUAL NUTREX BRAN AVENA MIEL PACK 306
26281;GALLETAS PASCUAL CHEESE CRISP QUESO BLANCO
13831;GALLETAS POZUELO TOSH AVELLANAS
16647;GALLETAS FIBER ONE BKD COOKIE CHOC CHUNK 31 GR
19818;GALLETAS MISURA BISCOT FRUTA/CEREAL 8.11Z
20563;GALLETAS D.RS COOKIES BLUEB-BAR OZ
27190;GALLETAS NESTLE FITNESS BISCUIT RED FRUIT 24 22G
3791;GALLETAS COSTA TUAREG 120 GR
17036;GALLETAS PASCUAL CHOCO CREAM
17315;GALLETAS DULCE MARIA CON LECHE COND 200
11313;GALLETAS DANESITA BUTTER COOKIES ORIGINAL G
17188;GALLETAS ORGRAN TORTILLA MULTIC.QUINOA G
5980;GALLETAS NABISCO CHIPS AHOY NABISCO 57 GRS 1 96
17238;GALLETAS POZUELO BOKITAS QU
9895;GALLETAS MULTIPACK CHOKIS 5UND
3753;GALLETAS QUAKER DE AVENA 187 GR MANZANA CANELA
10718;GALLETAS 8PK PRINCIPE CHOCOLATE 336 GR
16049;GALLETAS LIDO CREMAS LIDO CHOCO150GR
17239;GALLETAS POZUELO CLUB XTRA INTEGRAL 25 GR
20467;GALLETAS PASCUAL SORBETO VAINILLA 8UNID(208GR)
17692;GALLETAS BRIDGE MTACO FRESA 77GR
16765;GALLETAS BONNE MAMAN DE MANTEQUILLA 90G
14195;GALLETAS VOORTMAN WAFER FRESA S AZUCAR 255 GRS
17182;GALLETAS ORGRAN VAINILLA COOKIE GR
19958;GALLETAS GULLON MINI CHOCODIGESTIVE GR
7715;GALLETAS NABISCO OREO CHOOCOLATE 432 GR
15560;GALLETAS GULLON DIGESTIVE OAT&CHOCOOZ
17610;GALLETAS NABISCO HONY BRAN 33 GRS
17191;GALLETAS ORGRAN G/F CHIA WAFER CRACKERS 100G ( 720516023309 )
11318;GALLETAS SPONCH MARINELA 85GRS.
6639;GALLETAS POZUELO FAMILIA NAVIDAD 190 GR
17023;GALLETAS PASCUAL DE LECHE FAM
15706;GALLETAS POZUELO MANTEQUILLA 260 GRS
11458;GALLETAS NABISCO AVENY BRAN BELVITA CON AVENA Y PASAS 67.8
9101;GALLETAS COLOMBINA CRAKEÑAS CLUB 204 GR.
9860;GALLETAS MARINELA MIN/BARRITA MERMELDA 8U
19697;GALLETAS NOEL DUX BOLSA NOELUNID.
16901;GALLETAS ROLAND D ARROZ C PICANTE
17033;GALLETAS PASCUALMANTEQUILLA
9896;GALLETAS BANDEJA CHOKIS 252G
17026;GALLETAS PASCUAL SODITAS SOD
17136;GALLETAS WIBISCO SHIRLEY COCONUT BISCUIT PACKS
3684;GALLETAS POZUELO PASIÓN MARACUYA TOSH 164.8G
17142;GALLETAS DADDY LOW FAT STRAWBERRY BARS
18065;GALLETAS LIL DUTCH MAID L.M.D.GINGER SNAPS COOKIESOZ
20861;GALLETAS MATEQUILLA UN.GR PARMIGIANA
17024;GALLETAS PASCUAL CHOCO CREAM MANI
17004;GALLETAS PASCUAL COMBINACION X UND GR
21783;GALLETAS OTROS CRISPS CHOCOLATADOS 3 BOLSAS 4KGS
15552;GALLETAS COLUSSI INTEGRAL 250 GR 017538
20447;GALLETAS PASCUAL SANDWICH LIMON SIN A
21683;GALLETAS LIL DUTCH MAID ICED OATMEAL - OZ
9893;GALLETAS QUAKER DE AVENA 152 GR FRUTOS S MULTIPACK
17014;GALLETAS PASCUAL CREMAS SALTINES
13600;GALLETAS GULLON DESAY CEREAL FROJOS VITALD 8 220G
17053;GALLETAS PASCUAL CHOCOLATE LONCHERA 20 GR
17890;GALLETAS LENNY AND LARRYS COOKIES AVENA 16OZ
21845;GALLETAS PASCUAL MAR
17147;GALLETAS STRAWBERRY BARSONZ.
17611;GALLETAS NABISCO KRAKER BRAN 28 GRS
3547;GALLETAS RITZ CHEESE 408 GR
11372;GALLETAS GAMESA MINI SANDW CRACKETS 41G
10231;GALLETAS DADDY LOW FAT BLUEBERRY BARS Z
6310;GALLETAS PEPPERIDGE FARM PEPPF GOLDFISH CHED187G
11426;MINI BARRITAS PIÑA MARISELA 78 G
17118;GALLETAS MCVITIES INTEG AVENA MC VITIES 300G
15027;GALLETAS NABISCO OREO GOLDEN 432 GR
17008;GALLETAS PASCUAL MARIA FAMILIAR CAJA
7840;GALLETAS MOLSA SODA ORIGINAL 160 GR
8736;GALLETAS DULCES NAVIDAD COLOMBINA
3376;GALLETAS POZUELO BOKITAS QUESO BLANCO 354 GR
17199;GALLETAS STAUFFERS ANIMAL CRACKE CHOC 11OZ ( 72320118819 )
9103;GALLETAS DULCES NAVIDAD COLOMBINA
17733;GALLETAS NOEL SALTINES
10862;GALLETAS MAFAM MANZA CANELA 48 GR
10717;GALLETAS 8 PACK PRINCIPE LIMON 336 GR
16579;GALLETAS POZUELO CHIKY 40GRS
20526;GALLETAS COOKIES BUTTER TIN GR NEW CROWNBORG
3555;GALLETAS NABISCO OREO CHOCOLATE BLANCO 131.2 GR
13606;GALLETAS MAFAM AVENA PASAS LOW.48G
18081;GALLETAS POZUELO MARIA 1 UND
8584;GALLETAS COLOMBINA 150G BOLSA FELIZ NAVIDAD
17310;GALLETAS PARMIGIANA CREAM PUFF 12 GR
17697;GALLETAS WAFER BRIDGE FRESA COLOMBINA 151G
9002;GALLETAS EMPERADOR VAINILLA 100 GR.
21900;GALLETAS DANESA GR
17020;GALLETAS PASCUAL SANDWICH FRESA
17313;GALLETAS REGRESO A CLASE PARMIGIANA 240GR
16953;GALLETAS MCVITIES NEW GINGER NUTS 24 250GR CA
16950;GALLETAS MCVITIES FRUIT SHORTCAKE MC-VITI OZ
18072;GALLETAS LIL DUTCH MAID L.DUTCH MAID IC
13845;GALLETAS POZUELO CLUB XTRA CAJETA 1 36 S
13605;GALLETAS MAFAM NUTRI SNACK DE AVENA INTEGRAL C PASAS LITE 240 GRS
27420;GALLETAS KINNIKINNICK VANILLA WAFER
17559;GALLETAS NESTLE COOKIE SAVOY NESTLE 50G SUSY MAXI
17110;GALLETAS BAKERS BATCH D RAYS ICED OATMEAL COOKIESGRS.
16941;GALLETAS NABISCO RITZ BITS CHEESE SANDIW Z
13745;GALLETAS MATILDE VICENZI DULC RELL PAST VICENZI 125G
17698;GALLETAS WAFER VAINILLA LECHE COLOMBINA 151G
9715;GALLETAS POZUELO RECREO ROLLO 155 GRS
28975;GALLETAS MOLSA KIDDY VAIVAI CHOC 300GR
18069;GALLETAS LIL DUTCH MAID ASSORTED CREME COOKI
10847;GALLETAS RITZ ORIGINAL 21.5 GRS
10779;GALLETAS POZUELO BOKITAS C QUES 35 GR
32496;GALLETAS POZUELO CLUB EXTRA R
10755;GALLETAS COLOMBINA CRAKEÑAS MANTEQUILLA 216 GR
17006;GALLETAS PASCUAL CRISP DOCENA
21351;GALLETAS NOEL FESTIVAL CHOCOLATE 12UND
21953;GALLETAS MATEQUILLA UN.GR PARMIGIANA
17713;GALLETAS POZUELO NOEL SODAS PTOS 234 GR
17222;GALLETAS COLOMBINA PIAZZA BARQUILLOS DE FRESA 51 GR.
9057;GALLETAS CUETARA MARIA 200 GRM
13903;GALLETAS MATILDE VICENZOVO LADY FINGER 12/200G ( 8000350000585 )
17481;GALLETAS PIRUCREAM LATA 24 300 GRAMOS
11428;GALLETAS MINI BARRITA DE FRESA 6P MARINELA
17146;GALLETAS BLUEBERRY BARSONZ.
7875;GALLETAS GULLON GULLON VITALDAY CORN CAKES 4PACK 108 GR
8625;GALLETAS COLOMBINA CRAKINUA CLUB INTEG 6U-165979
6308;GALLETAS PEPPERIDGE DOUBLE CHOCOLATE MILANO 7.5 ONZ
15979;GALLETAS GULLONSIN GLUTEN 400 GR VAINILLA
18083;GALLETAS POZUELO CANASTA GUAYABA BS 21.6 GR
19734;GALLETAS ARCO CHOCO CHIPS 24 135 GR ARCOR
13828;GALLETAS POZUELO TOSH YOGOURT Y ARANDANOS 1 UND
14713;GALLETAS SALUD NABISCO KRAKER B 252GR
17001;GALLETAS PASCUAL WAFER SABOR CHOCOLATE 30GRS
27200;GALLETAS MISURA FETTE IPOSODICHE MISURA 16/320G
16956;GALLETAS MC VITIES AHEAD ORANGEGRS.
18321;GALLETAS ROLAND DE FRESA 200 GR TARTALETA
6664;GALLETAS POZUELO CHIKY ROLLO 153 GR 1 UND
17109;GALLETAS ALMONETTE COOKIESGRAMOS
17037;GALLETAS PASCUAL CHOCO CREAM
18637;GALLETAS GAMESA SALADAS PANCREMA 106 GRS
16750;GALLETAS ALLETA CLUB CHEEDAR KEEBLER 191 G
16161;GALLETAS BLUE DIAMOND GALLETA ALMEN/ARRO
11655;GALLETAS PEPPERIDGE FARM CHOC MACAD 206G
17730;GALLETAS POZUELO NOEL S WAFER VAINILLA BS 432GR
14194;GALLETAS VOORTMAN WAFER CHOCOLATE S AZUCAR 255 GRS
32631;GALLETAS RONDOLETTI CHOCOLATE HAZELNUT
16353;GALLETAS MATILDE VICENZI DULCES VICENZI AMARETTO 200 G 3MVI02
17234;GALLETAS MARINELA PRICIPE
17009;GALLETAS PASCUAL SANDWICH LIMON FAMIL
16965;GALLETAS JOCASTA VINNESE W VAINILLA GRS.
15833;GALLETAS DEBEUKELAER PIROULINE CREME TIN 14 ONZ
13830;GALLETAS POZUELO TOSH LIMON C/ TE VERDE UNIDAD
19729;GALLETAS ARCOR MANA FRUTILLAGRS
15523;GALLETAS BAUDUCCO WAFER SABOR AVELLANA 140 GRS
16415;GALLETAS ROLANDWATER CRACKER REGULAR
16567;GALLETAS MC VITIES AHEAD CRYSPY SLICE
32701;GALLETAS CUETARA SODA 160 GRS
9663;GALLETAS HANDI SNACK RITZ CRACKERSGRS
17235;GALLETAS MARINELA PRICIPE
17098;GALLETAS JULES DESTROOPER DE CHOCOLATE BELGA GRS
17097;GALLETAS JULES DESTROOPER CHOCOL.BELGA VIRTUOSO GR
19772;GALLETAS ITAMARATY FIORETTO CHOCOLATEGR
17022;GALLETAS PASCUAL SALTINES INDIVIDUAL GR
17010;GALLETAS PASCUAL CRISP FAMILIAR GR
18851;GALLETAS PEPPERIDGE FARM MILANO DULCE LECHE 198 G
34086;GALLETAS BELGIAN BUTTERS PATISSERIE 80 GR 12 CJ
17040;GALLETAS PASCUAL SODITAS FAMI
10854;GALLETAS ROSQUILLA CHOCOL.BLAN
19770;GALLETAS ITAMARATY SPANTOOO WHITE CHOCOGR
16964;GALLETAS JOCASTA VINNESE W HAZELNUT GRS.
17307;GALLETAS PARMIGIANA SANDWICH CH 12 GR
32632;GALLETAS RONDOLETTI CHOCOLATE HAZELNUT
17030;GALLETAS PASCUAL SAND LIMON SIN AZUCAR 6 PACK
17476;GALLETAS BUDS BEST PECAN CHOCOLATE CHIP 6OZ
34129;GALLETAS NABISCO MINI CHIPS AHOY MULTIPACK 12 OZ
14185;GALLETAS DARE BRETON ORIGIN 225GR
17548;GALLETAS CLUB SOCIAL REGULAR 26GR
17051;GALLETAS PASCUAL SORBETO VAINILLA 26 GR
14192;GALLETAS MVIEJITA D MANTEQ 18U
16772;GALLETAS WASA FLAX SEED CRISPBREAD G
17063;GALLETAS PASCUAL DE MANTEQUILLA EN DOC 360GR
17209;GALLETAS ROYAL DANSK LIGO DANISH STYKE BUTTER COOKIES 454 GR
17035;GALLETAS PASCUAL CHEESE CRISP --GR KIT
16773;GALLETAS WASA MULTI GRAIN CRISPBREADOZ
17694;GALLETAS BRIDGE MTACO AREQUIPE 77GR
18008;GALLETAS GULLON DIET FIBRA MUESLIGR
14193;GALLETAS VOORTMAN DE COCO VOORTMAN 200 GRS
20427;GALLETAS PASCUAL SAND-FRESA GR
17039;GALLETAS PASCUAL PASAS X UND
19814;GALLETAS COLUSSI DULCES 300 GR
17143;GALLETAS DADDY RAYS FIG BARSONZAS
18089;GALLETAS POZUELO BOKITA QUESO BLANCO 10UN+2 GRATIS
6641;GALLETAS POZUELO RELLENA CHOCOLATE Y VAINILLA PAQ 1 DZ
17717;GALLETAS POZUELO NOEL DUCALES BS XL UND
19815;GALLETAS COLUSSI DULCES 300 GR
17699;GALLETAS WAFER DULCE DE LECHE COLOMBINA 151G
19820;GALLETAS MISURA MULTIGRAIN SENZA OLIO 12/350G
10050;GALLETAS GAMESA DULCE NAVIDAD 250GR
17186;GALLETAS ORGRAN TORTILLA MAIZ GLUTEN GR
8461;GALLETAS MANT/COLOMBINA 252G ARBOLIT/NAVIDAD
34589;GALLETAS COLOMBINA SALTIN SALAD A 200 GR
17308;GALLETAS MARIA PARMIGIANA PAQ UNID.
19792;GALLETAS SAPORI CANTUCCINI TOSCANI SAPORI 10/175 GR ( 8000895003355 )
17144;GALLETAS FIG BARSONZAS D RAYS
19306;GALLETAS STAUFFERS CRUJIENTE SABOR A MANZANA 397GRS
11310;GALLETAS POZUELO TOSH AVENA GRANOLA 26G
17318;GALLETAS SALATI SODA 283.5GR
19952;GALLETAS GULLON DORADAGRS
17095;GALLETAS J D DE MANTEQUILLA GRAMOS
17107;GALLETAS BAKERS BATCH OATMEAL CRANBERRYONZAS
17133;GALLETAS WIBISCO 110G TEA TIM/CHOCOL/BISCUIT
19731;GALLETAS ARCOR MANA LIVIANAS VAINILLA
19832;GALLETAS COLUSSI DULCES 300 GR
34214;GALLETAS SORBET CUETARA YOGURT-MELOC PAQ 250 GR
19949;GALLETAS GULLON DIGESTIVE GR
18883;GALLETAS FIBER ONE CHOCOLATE CUNK GR
18064;GALLETAS LIL DUTCH MAID DUCH MAID ICED
10108;GALLETAS GULLONSIN GLUTEN 130 GR CHOCO CHIP
17061;GALLETAS PASCUAL LECHE UNIDAD 28 GR
17314;GALLETAS REGRESO A CLASE AVENA Y CHISPA CHOC 240G
17520;GALLETAS QUAKER ARCO 37 GRS
22644;GALLETAS SANDWICH FRESA 36U 936GR.
17714;GALLETAS NOEL SALTIN NOEL SEMILLAS CEREAL.G
17025;GALLETAS PASCUAL CHOCO CREAM MANI
17041;GALLETAS PASCUAL SALTINES FAMILIAR GR
19714;GALLETAS NOEL QUESO MANTEQUILLA UN
19833;GALLETAS COLUSSI DULCES 300 GR
17704;GALLETAS NOEL DUX
34519;GALLETAS CASABITOS DE YUCA SINGLE NATURAL
19965;GALLETAS GULLON TRADIZIONALEGR
34763;GALLETAS RITZ BITS CHEESE 28 GR UNIDAD
19839;GALLETAS COLUSSI DULCES 650 GR
15020;GALLETAS GAMESA CREMAX NIEVE FRES
17316;GALLETAS SALATI CRISPY 288GR
17642;GALLETAS LOACKER BITE SIZE WAFER COOKIES HAZELNUT
52772;GALLETAS QUAKER DE AVENA 48 GR MANZANA CANELA
18320;GALLETAS ROLAND DE CHOCOLATE 200 GR TARTALETA
21854;GALLETAS PASCUAL SORBETO VAINILLA 8UNID(208GR)
25797;GALLETAS SOPHIA'S ICED OATMEA
20387;GALLETAS MCVITIES GO AHEAD CRISPY ORANGE GR
17048;GALLETAS PASCUAL CREAM LIMON EXHIBIDOR 24 1488G
17135;GALLETAS WIBISCO SHIRLEY VAINILLA BISCUIT PACKS
21577;GALLETAS ROYAL DANSK 908GR
4490;GALLETAS POZUELO SAL CLUB EXT
19458;GALLETAS THE GARDEN POP PAN 200 GR
18074;GALLETAS LIL DUTCH MAID CHOCO CR OZ
16966;GALLETAS JOCASTA VINNESE WAFERS FRESA GR
17076;GALLETAS PASCUAL DE CHICLE DOC 360 GR
20414;GALLETAS PASCUAL SAND LIMON X UND GR
13552;GALLETAS QUAKER 362563 PRACTIPACK AVENA QUAKER GRANOLA
17311;GALLETAS PASITAS UN GR PARMIGIANA
19765;GALLETAS ITAMARATY WAF FIESTA NEGRA G
19840;GALLETAS COLUSSI DULCES 650 GR
17829;GALLETAS GRANIX FRUTIGRAN AVENA Y PASAS
10861;GALLETAS MAFAM SUGAR FREE ORANGE GRAMOS
19695;GALLETAS DE LECHE COLOMBINA
18737;GALLETAS BAUDUCCO WAFER DISPLAY VAINILLA
21852;GALLETAS PASCUAL DE PASAS
20443;GALLETAS PASCUAL ANIMALITO DOCENA
17711;GALLETAS NOEL SALTIN PENTAPACK NOEL GRS.
17306;GALLETAS SANDWICH LIMON 12 GR
19779;GALLETAS GULLON CACAO MARIA CHOCOLATE GR
17074;GALLETAS PASCUAL DE AVENA 360G.
17029;GALLETAS PASCUAL MARIA SIN AZUCAR 6 PACK
20380;GALLETAS MC VITIES FRUIT SHORTCAKE GR
17138;GALLETAS WIBISCO SHIRLEY COCONUT BISCUIT FAMILY
17825;GALLETAS ARCOR BAGLEY ARGENTINA CHOCOLINAS 170G
19834;GALLETAS COLUSSI DULCES 300 GR
18004;GALLETAS GULLON MINI OGR
25799;GALLETAS SOPHIA'S ICED OATMEA
17727;GALLETAS NOEL SALTIN NOEL E LARGA
17152;GALLETAS VOORTMAN WAFER LIMON S AZUCAR 255 GRS
17894;GALLETAS ROYAL DANSK NEW GROWNBORG MANTEQUILLA 454GR
20846;GALLETAS GAMESA LONCHERA MINI CHOKIS GR
17712;GALLETAS NOEL DUCALES TACO DIA 120GR
34523;GALLETAS VIRGINIAS MINI VITA BOER CHOC.S AZUCAR UN
20423;GALLETAS PASCUAL SODA X UND GR
19334;GALLETAS SOPHIA'S CHOCO SANDW
17214;GALLETAS LUNDBERG BROWN RICE CAKES SALTED 8 5 OZ
19575;GALLETAS LONCHERA MINI SANDWICH G
10363;GALLETAS KEEBLER CUBIERT CHOC FUDG STRIP 326 G
17237;GALLETAS POZUELO TOSH FUSION DE CEREALES 1 UND
17705;GALLETAS NOEL FESTIVAL VAINILLA BOLSA 24 14.392Z
10095;GALLETAS CHOCORISAS CHOCLATE FRESA 300GR
18023;GALLETAS JOCASTA VINNESE W VAINILLA GRS.
19837;GALLETAS COLUSSI DULCES 250 GR
20453;GALLETAS PASCUAL CHOCO CREAM GR
19962;GALLETAS GULLON BARQUILO CHOCO DIET NATURE G
20473;GALLETAS PASCUAL CHEESE CRISP DOCENA QUESO AMARILLO 444GR
14088;GALLETAS KEEBLER EXPORT SODA LATA 28 ONZAS
27287;GALLETAS MC VITIES - DIGESTIVE LIGHT
17140;GALLETAS BIMBO SANISSIMO TOSTADA DE MAIZ HORNEADAS 18 G
17312;GALLETAS DE COCO UN GR PARMIGIANA
19967;GALLETAS GULLON DESAY VITALD AVENA CH CHOC 8 240G
17477;GALLETAS BUDS BEST GOLDEN VANILLA WAFERS 284GR
20854;GALLETAS SANDW.FRESA PAQ G.PARMIGIANA
17113;GALLETAS DE MANTEQUILLA 12 340GR
27491;GALLETAS MIKAELAS COOKIES CHOCOLATE CHIP
20431;GALLETAS PASCUAL CHOCO MANI GR
21712;GALLETAS POZUELO CREMA COMBINACION
17708;GALLETAS POZUELO NOEL FESTIVAL CHOCO BOLSA 34 GR
17702;GALLETAS NESTLE MILO SANDWICH COOKIE 24(12X36.
19966;GALLETAS GULLON FRUTA Y FIBRA GR
21637;GALLETAS GULLON-MARIA LIGERA SALT FREE 200G
19838;GALLETAS COLUSSI DULCES 250 GR
11300;GALLETAS POZUELO SODA 176GRS PAQ 8 UND
19579;GALLETAS NAVIDAD PARMIGIANA GR
21946;GALLETAS SANDW.FRESA PAQ G.PARMIGIANA
20421;GALLETAS PASCUAL VAINILLA DOCENA
18110;GALLETAS LOTTE DREAN CAKE DULCE DE CHOCOLATE PREM
18066;GALLETAS LIL DUTCH MAID VAINILLA CREME 12 13OZ
34535;GALLETAS BUFF BAKE COOKIE WHITE CHOCOLATE PEANUT BUTTER
17740;GALLETAS OREO COOKIES & CREAM UND NABISCO
17145;GALLETAS APPLE BARS D RAYSONZ
17640;GALLETAS LOACKER SAN ANDRES SALTY240GR
18470;GALLETAS LOACKER WAF.LOA.QUA.CHO 8.82OZ
26268;GALLETAS PERRERO PALITO NUDE CHOC 50G
28669;GALLETAS NABISCO CHIPS AHOY WHITE FUDG
21347;GALLETAS NOEL DELUXE GRS
19768;GALLETAS ITAMARATY SPANTOOO CHOCOLATEGR
17920;GALLETAS BALOCCO WAFERS BALOCCO AVELLANA
21709;GALLETAS POZUELO INTEGRAL
21034;GALLETAS KRIT
28709;GALLETAS BRAZILIAN BISCUIT ITAS DE VAINILLA
18062;GALLETAS LIL DUTCH MAID L.DUTCH MAID CH
17241;GALLETAS POZUELO MARIA INTEGRAL UND
17731;GALLETAS POZUELONOEL WAFER NOEL FRESA 432GR
19968;GALLETAS GULLON TWINS SANDWICH CHOC 16 154G
20463;GALLETAS PASCUAL CHOCO CREAM CHOCOLATE 6 PACK
22590;GALLETAS CHORISAS CHO CHO 24 300 GRS
21694;GALLETAS POZUELO BOKIT RELLENA DE QUESO TUBO 141.5 GR
